The William Brinton 1704 House is located in Delaware County Pennsylvania just south of West Chester Pennsylvania.	Building
HM Prison Wormwood Scrubs (informally The Scrubs) is a Category B men's prison located in the Wormwood Scrubs area of the London Borough of Hammersmith and Fulham in inner west London England. The prison is operated by Her Majesty's Prison Service.	Building
Rufus Wilson Complex is a group of historic buildings located at Clear Spring Washington County Maryland United States. The property includes a complex of mid-late 19th century buildings which create the center of a small rural settlement named Conococheague located on the National Road. The main house is a large brick dwelling with a mansard roof.	Building
Ellis School is a school building in Ashland Wisconsin which was added to the National Register of Historic Places on July 17 1980. It is noted for its architecture—the design of Henry Wildhagen—which is of the 19th- and 20th-century revival styles.	Building
The Unionskirche (Union Church) is the active Protestant parish church of Idstein a major town in the German Rheingau-Taunus-Kreis. Idstein was a residence of the Counts of Nassau.	Building
The Petrus- en Pauluskerk (English: Peter and Paul Church) is a church in Loppersum in the Netherlands. It is a rijksmonument and in the Top 100 Dutch heritage sites.	Building
The United States Post Office (also known as the Old Federal Building) at 209 East Portage Avenue in Sault Ste. Marie Michigan is an historic building which has served various purposes since its construction. The building was listed on the National Register of Historic Places on September 9 1977.The building was constructed in 1909-1910 out of limestone from a Bedford Indiana quarry.	Building
East Gate Square is a shopping center complex located along the border between Moorestown and Mount Laurel in New Jersey. East Gate Square is adjacent to the Moorestown Mall and it is accessible from Interstate 295 Route 38 and Route 73.The shopping complex consists of six buildings with a total of 888842 square feet (82576.1 m2) of retail space. The six shopping centers were developed by BPG Properties between 1992 and 2002 and the first one opened in 1993.	Building
The Tachara Taçara Tachara of Darius Tachar Château Mirror Hall or exclusive palace of Darius I is one of the interior Persepolis Palaces. The meaning in olden Persian is wintry home. The palace is made of gray stone. It was built by Darius I but only a small portion of the palace was finished under his rule and it was completed after his death in 486 by his son and successor Xerxes I who called the house a Taçara winter palace. Artaxerxes I continued to use the palace.	Building
Balboa Park is a 1200-acre (490 ha) urban cultural park in San Diego California United States. In addition to open space areas natural vegetation zones green belts gardens and walking paths it contains museums several theaters and the world-famous San Diego Zoo. There are also many recreational facilities and several gift shops and restaurants within the boundaries of the park.	Building
The Uxbridge Passenger Depot is an historic railroad station located at 28 South Main Street in Uxbridge Massachusetts. On October 7 1983 it was added to the National Register of Historic Places.	Building
The Kunsthalle Bremen is an art museum in Bremen Germany. It is located close to the Bremen Old Town on the Culture Mile (German: Kulturmeile). The Kunsthalle was built in 1849 enlarged in 1902 by architect Eduard Gildemeister and expanded several more times most notably in 2011.	Building
Tornaco Castle is a castle in Vervoz in the municipality of Clavier Belgium.	Building
The Former Church of St Mary Wythall is a Grade II listed redundant parish church in the Church of England in Wythall Worcestershire.	Building
The Shriners Hospital for Crippled Children also known as Old Shriners Children's Hospital was a building in Portland Oregon built in 1923. It was designed in Colonial Revival style with aspects of the Georgian Revival style subtype. It was listed on the National Register of Historic Places in 1989 and removed on 2011 after being deconstructed in 2004.	Building
Ungurmuiža Manor (Latvian: Ungurmuižas kungu māja) is a manor house in the historical region of Vidzeme in northern Latvia. The estate is named for the von Ungern family who owned it prior to the middle of the 17th century. The current wooden manor was built in 1731-1732 in Baroque style for the owner Lieutenant General Balthasar Freiherr von Campenhausen. The von Campenhausen family owned the estate from 1728 to 1939.	Building
The Teddy Bear Museum of Naples was a visitor attraction located in north Naples Florida USA. It opened in 1990 and closed in 2005. It operated as a non-profit organization and received funding from donations as well as profit from museum tickets gift shop sales and Hug Club membership.	Building
The Herbert H. Dow House also known as Dow House was the home of Herbert H. Dow founder of Dow Chemical Company from 1899 until his death in 1930. His wife Grace and five children survived him and continued to reside there. It was declared a National Historic Landmark in 1976.Back side of Dow home.	Building
Salmon P. Chase Birthplace was the birthplace and childhood home of Salmon P. Chase.It was declared a National Historic Landmark in 1975.It is located about 8 miles north of Claremont on New Hampshire Route 12A.	Building
The BC Forest Discovery Centre located in Duncan chronicles the history of logging in British Columbia Canada. Its mission is to be British Columbia's foremost interpreter and presenter of the forest community – past present and future. It is a 100 acre site with 3 km of operational 3 ft (914 mm) narrow gauge railway.	Building
The Sprague House is a historic house at 59 Endicott Street in Danvers Massachusetts. The well preserved 2.5 story wood frame Federal style house was built in 1810 for Joseph Sprague Jr. son of a wealthy Salem merchant who was also involved in the family business. The house's main Federal feature is its central doorway which features a semicircular fanlight window and a pedimented overhang supported by pilasters.The house was listed on the National Register of Historic Places in 1987.	Building
The Downtown North Historic District is a 19-acre (7.7 ha) historic district in Hartford Connecticut. The area was listed on the National Register of Historic Places in 2004. It is a predominantly residential area located around Main Street and High Street north of I-84 and south of the Amtrak railroad tracks.[citation needed] There are 28 contributing buildings in the district that represent Mid-19th Century Revival and Late Victorian styles of architecture in the district.	Building
Chen Zhongshi (simplified Chinese: 陈忠实; traditional Chinese: 陳忠實; pinyin: Chén Zhōngshí) is a Chinese author born in June 1942 in Xi'an. He started writing prose in 1965 and finished his magnum opus White Deer Plain in 1993 (for which he won Mao Dun Literature Prize in 1996). In 1979 he became a member of the Chinese Writers Association (which he at one point served as the association's vice chairman).	Artist
Diana Chang (born 1934) is a Chinese American novelist and poet. She is best known for her novel The Frontiers of Love one of the earliest novels by an Asian American woman. She is considered to be the first Chinese American (born in the States) to publish a novel in the States.	Artist
Cliff Robinson is a British comic book artist probably best known for his cover work on 2000 AD and contributions to the Judge Dredd strip.	Artist
James Edward Kelsey (born November 15 1964) is an American Abstract Expressionist sculptor best known for creating large stainless steel abstract curvilinear sculptures.	Artist
John William Cheever (May 27 1912 – June 18 1982) was an American novelist and short story writer. He is sometimes called the Chekhov of the suburbs. His fiction is mostly set in the Upper East Side of Manhattan the Westchester suburbs old New England villages based on various South Shore towns around Quincy Massachusetts where he was born and Italy especially Rome.	Artist
Edwin Edgerton Aiken (March 1 1859 – January 5 1951) was an American Congregationalist minister and author who spent over four decades as a missionary and educator in China.Born in Newington Connecticut he graduated from Yale University in 1881 where he was Phi Beta Kappa and a member of Skull and Bones. The following year he published The Secret Society System. While not naming Skull and Bones he objected to the exclusiveness of societies and fraternities.	Artist
Rob Brown (born February 27 1962) is an American free jazz saxophonist and composer.	Artist
Sarah Nyberg Pergament is a Swedish electronica artist. Releases her own music under the name Action Biker. After releasing two singles Sandy Edwards in 2002 and Elephant & Castle in 2003 her début album Hesperian Puisto was released in 2008 on the Friendly Noise record label and gained 4/5 in the Swedish morning paper Dagens Nyheter. One of her songs from the album Love for sure also appears in the American TV show The Middleman which aired the first time during 2008.	Artist
Ong Ai Leng (Chinese: 王爱玲; pinyin: Wáng Àilíng) is a Malaysian actress based in Singapore.	Artist
Per Husby (born 2 April 1949 in Oslo) is a Norwegian jazz musician (piano) composer teacher civil engineer and orchestra leader known for a number of recordings.	Artist
Rahul Dev Burman (27 June 1939 – 4 January 1994) was an Indian film score composer who is considered one of the seminal music directors of the Indian film industry. Nicknamed Pancham da he was the only son of the illustrious composer Sachin Dev Burman.From the 1960s to the 1990s RD Burman composed musical scores for 331 movies. He was mainly active in the Hindi film industry as a composer and also provided vocals for a few of compositions.	Artist
Anton Gill (born 1948) has been a full-time professional writer since 1984 and since then he has published over 35 books.Gill was born in Ilford Essex the son of a German father and an English mother and grew up in London.	Artist
Tom Astor (born February 27 1943) is a German singer and composer. He is noted for his extensive country and western recordings. He has worked with Charlie McCoy.	Artist
Stan Coster OAM (27 May 1930 – 25 March 1997) was an Australian country music singer-songwriter. His songs were regularly performed by Slim Dusty and other singers. He is the father of country music singer Tracy Coster.	Artist
Qin Hao (Chinese name: Chinese: 秦昊; pinyin: Qín Hào) is a Chinese actor. He is known for starring in the 2009 film Spring Fever.	Artist
Vladimir Vlado Janevski (Macedonian: Владимир Владо Јаневски [ˈvlaːdɔ ˈjanɛfski] ) is a popular Macedonian singer. He was Macedonia's first Eurovision contestant finishing 19th in Birmingham at the 1998 Eurovision Song Contest with the song Ne Zori Zoro.	Artist
Kaj Skagen (born October 23 1949 in Strandebarm) is a Norwegian writer. He received the Riksmål Society Literature Prize in 1991. His first book Gatedikt was published in 1971. From 1978 to 1989 he published and edited the periodical Arken. In 1982 he won the first prize of a national novel contest with the novel Broene brenner. In 1983 he published Bazarovs barn a harsh critique of contemporary Norwegian literature.	Artist
Calvin Carter is the brother of the founder of Vee-Jay Records Vivian Carter. Born May 27 1925. He joined the company in 1953 and became the principal producer in charge of the recording sessions. He is a songwriter and composer of jazz and popsongs.	Artist
Allan Gwynne-Jones CBE DSO RA (27 March 1892 – 5 August 1982) was an English painter.Gwynne-Jones was born in Richmond Surrey. He was educated at Bedales School and then qualified as a solicitor but never practised. He instead developed a love of art and began painting watercolours. In 1914 he began a course at the Slade School of Fine Art but three months later was commissioned into the Welsh Guards Cheshire Regiment.	Artist
Thomas Cole (February 1 1801 – February 11 1848) was an American artist. He is regarded as the founder of the Hudson River School an American art movement that flourished in the mid-19th century. Cole's Hudson River School as well as his own work was known for its realistic and detailed portrayal of American landscape and wilderness which feature themes of romanticism.	Artist
John Charles McDermott (born 25 March 1955) is a Scottish-Canadian tenor best known for his rendering of the song Danny Boy. Born in Glasgow Scotland John moved with his family to Willowdale Ontario Canada in 1965. Growing up in a musical family his only formal musical training was at St. Michael's Choir School in Toronto Ontario in 1971 and 1972.	Artist
Vidadi Yusif oglu Babanli (Azerbaijani: Babanlı Yusif oğlu Vidadi) (born in 1927 Qazakh) is an Azerbaijani writer dramatist translator and Merited Artist of Azerbaijan.	Artist
Peter York real name Peter Wallis born 1944 is a British management consultant author and broadcaster most famous for co-authoring Harpers & Queen's The Official Sloane Ranger Handbook with Ann Barr. He is also a columnist for The Independent on Sunday GQ and Management Today and Associate of the media analysis and networking organisation Editorial Intelligence.	Artist
Mohammed El-Bakkar (Arabic: محمد البكار‎; died in Pawtucket Rhode Island United States September 8 1959) was a Lebanese tenor oud player and conductor.El-Bakkar was a noted tenor and appeared in several Arabic-language films. He moved to the United States in 1952 and lived in Brooklyn. He released several LPs of Arabic music in the United States.	Artist
Michael J. Moran (b. ca. 1794; d. 3 April 1846) popularly known as Zozimus was an Irish street rhymer. He was a resident of Dublin and also known as the Blind Bard of the Liberties and the Last of the Gleemen.	Artist
Diane Mantzaris (born 1962) is an Australian artist known for her pioneering application of digital imaging to printmaking and for her unconventional approach to image making which is often both personal and political in content. Mantzaris pioneered the use of computers as a printmaking and art-making tool in the early to mid-1980s exhibiting widely nationally and throughout Asia in touring exhibitions to considerable acclaim.	Artist
Kim Seon-wu is a Korean feminist poet.	Artist
For the boxer see Bridgett Riley.Bridget Louise Riley CH CBE (born 24 April 1931 in Norwood London) is an English painter who is one of the foremost exponents of Op art. She currently lives and works in London Cornwall and France.	Artist
Andrej Trobentar (born 22 November 1951) is a Slovene painter illustrator and musician. Trobentar was born in Sveti Jurij near Grosuplje in central Slovenia in 1951. He graduated from the Academy of Fine Arts in Ljubljana in 1976 and specialized in painting under Jože Ciuha. He works as a painter art teacher and illustrator.	Artist
Ashley Parker Angel (born August 1 1981) is an American singer songwriter and actor who rose to fame with the boyband O-Town.	Artist
For the 19th-century politician see Charles Lamy (New York).Charles Lamy (28 August 1857 – 15 June 1940) was a French actor. He was often cast to play aristocratic characters.Lamy was born in Lyon France and died in Orléans in 1940.	Artist
Jędker (Polish pronunciation: [ˈjɛntker]) real name Andrzej Wawrynkiewicz (Polish pronunciation: [ˈandʑɛj vavrɨnˈkʲiɛvit͡ʂ]) is an MC from Warsaw Poland. Member of ZIP Skład (Ziomki i Przyjaciele) and WWO (W Witrynach Odbicia W Wyjątkowych Okolicznościach) together with DJ Deszczu Strugi and Sokół.	Artist
Maggie Lau (Chinese: 劉思惠) is a Hong Kong actress and singer. She starred in New Police Story The Twins Effect and also had a small acting part in The Myth alongside Jackie Chan and Korean actress Kim Hee-sun.She has had a minor musical career as a member of the now dissolved girl group 3T. In 2004 she sang in the song Girls together with Boy'Z and also appeared in the music video.	Artist
Daniel Garber (1880–1958) was an American Impressionist landscape painter and member of the art colony at New Hope Pennsylvania. He is best known today for his large impressionist scenes of the New Hope area in which he often depicted the Delaware River. He also painted figurative interior works and excelled at etching. In addition to his painting career Garber taught art at the Pennsylvania Academy of the Fine Arts for over forty years.	Artist
Joaquin Miller was the pen name of the colorful American poet Cincinnatus Heine (or Hiner) Miller (September 8 1837 – February 17 1913) nicknamed the Poet of the Sierras.	Artist
Gerda J. Helland Grepp (1907 – 29 August 1940) was a Norwegian translator and journalist. She was the daughter of former chairman of the Norwegian Labour Party Kyrre Grepp and journalist Rachel Grepp.	Artist
Felicia Flay Brandström (/ˈflaɪ/; born January 23 1987) is a Swedish singer and competed as one of the finalists in Idol 2006 — the Swedish version of Idol.	Artist
Kurt Lockwood (born June 4 1970 in Baltimore Maryland) is an American pornographic actor model and musician.	Artist
Philip Spalding (born 19 November 1957 London England) also known as Phil Spalding is an English bass player. He is best known as a session musician and player of Fender Precision Bass guitars. He has played and appeared with performing artists such as Mick Jagger Seal Orchestral Manoeuvres in the Dark Elton John and Randy Crawford.At an early age he was a successful child model and appeared in a television advertisement for Smiths Crisps.	Artist
Michael Hickey originally of Manhasset New York is a screenwriter best known for the screenplay of the horror film Silent Night Deadly Night. Hickey's controversial screenplay focused on a serial killer who disguised as Santa Claus takes the lyric He knows if you've been bad or good so be good for goodness sake rather too literally.Hickey also authored the stage play Murrow about the life of newscaster Edward R.	Artist
Juan José Cuadros Perez (Palencia October 9 1926 - Madrid May 27 1990) was a Spanish writer who cultivated poetry and prose.	Artist
Clarence Hawkes (December 16 1869 – January 19 1954) was an American author and lecturer known for his nature stories and poetry. Born in Goshen Massachusetts Hawkes was physically disabled at a young age; part of one leg was amputated when he was nine and he became blind four years later after a gun discharged in his face during a hunting accident. He was subsequently schooled at the Perkins School for the Blind in Boston where he befriended the young Helen Keller.	Artist
Mark Allen Stuart (born April 14 1968 in Owensboro Kentucky) is a Christian rock musician and is best known for having been the vocalist for Audio Adrenaline.	Artist
Vuk Kulenovic (born 1946) is a contemporary composer and teacher based in Boston Massachusetts. He teaches counterpoint orchestration and directed study at Berklee College of Music. He actively composes and has commissions from around the world. His influences are wide-tanging including jazz Indian ragas Balkan folk music rock and many other contemporary styles.	Artist
Julius Friedrich Antonio Schrader (16 June 1815 Berlin – 16 February 1900 Lichterfelde) was a German painter associated with the Düsseldorf school of painting.	Artist
Ryan Frank Cabrera (born July 18 1982) is an American pop rock singer and musician. In 2004 Cabrera debuted with his single On the Way Down a top ten hit in the U.S. and album Take It All Away. He continued his career with two more albums You Stand Watching in 2005 and The Moon Under Water in 2008.	Artist
Andy Gerold (born June 13 1978 in Sandusky Ohio) is a professional multi-instrumentalist and is best known as a former bassist of Marilyn Manson. Currently playing guitar for Rock of Ages at The Venetian Hotel & Casino in Las Vegas (as of 1/2013).	Artist
Bane Bojanić (Serbian: Бане Бојанић) is a popular Serbian singer. He is the son of famed singer Miloš Bojanić and the older brother of singer Mikica Bojanić. Bane was widely known for the hits Pola vino pola voda and Samo pijan mogu da prebolim.Bane lived in Detroit Michigan in the United States and owned a trucking company. He moved back to Serbia by 2008.	Artist
Anton Alexander von Werner (May 9 1843 – January 4 1915) was a German painter in the Kingdom of Prussia.Werner was born in Frankfurt (Oder) in the Province of Brandenburg. He began painting in 1857 as a student painter then studied painting at the Academy of the Arts in Berlin. He pursued his studies at Karlsruhe where he studied under Johann Wilhelm Schirmer Ludwig Des Coudres and Adolf Schroedter.	Artist
Muramatsu Shōfu (村松梢風) (21 September 1889 - 13 February 1961) was the pen-name of Muramatsu Giichi a Japanese novelist active during the Shōwa period of Japan.	Artist
Machi Tawara (俵 万智 Tawara Machi born December 31 1962) is a contemporary Japanese writer translator and poet.Tawara is most famous as a contemporary poet.	Artist
Marit Elisabeth Larsen (born 1 July 1983) is a Norwegian singer and songwriter. She began playing violins at age of 5 and played it until the age of 8. She gained international fame during her teenage years as a member of the pop duo M2M with childhood friend Marion Raven. More recently she has pursued her own music career releasing her solo debut album Under the Surface in 2006. Her second album The Chase was released in Norway in October 2008.	Artist
Jessica Taylor (born 23 June 1980) is an English singer glamour model television personality dancer best known for being a member of the Brit Award-winning pop group Liberty X from 2001 to 2008 and again in 2013 for a one-off reunion.	Artist
The Reverend Professor Noel Cox is a New Zealand-born lawyer priest and a professor at Aberystwyth University United Kingdom. He is a specialist in constitutional law and a prominent advocate of the Monarchy in New Zealand having being a long-term Chairman of the Monarchist League of New Zealand now Monarchy New Zealand. He was also Convener of the Auckland District Law Society Public Issues Committee.	Artist
Mary Benson (née Sidgwick; 1841 - 1918) was an English hostess of the Victorian era. She was the wife of Revd. Edward Benson who during their marriage became Archbishop of Canterbury i.e. chief bishop of the Church of England and of the world-wide Anglican communion. Their children included several prolific authors and contributors to cultural life. When she was widowed she became involved with Lucy Tait daughter of the previous Archbishop of Canterbury.	Artist
Ray Robertson is a Canadian novelist and a contributing book reviewer at The Globe and Mail. His most recent work Why Not?: Fifteen Reasons to Live was short-listed for the Hilary Weston Prize for non-fiction and long-listed for the Charles Taylor Prize for non-fiction. He lives in Toronto Ontario. His newest novel I Was There the Night He Died will be launched in the Spring of 2014.	Artist
Kraus (also known as Pat Kraus formerly known as Prince Kraus) is a New Zealand experimental musician and composer. The New Zealand Listener called him a national treasure and one of the most quietly important and interesting people making music in New Zealand.His music crosses the boundaries of electronic music post-rock no wave space folk noise pop punk rock and martian stomp.	Artist
Giovanni Paolo Caprioli (c.1580 - c.1627) was an Italian priest abbate in Candiana and composer.His Vulnerasti cor meum has been performed and recorded by Philippe Jaroussky. Two other solo motets - In lectulo per noctesand Congratulamini mihi omnes - appear in Ghirlanda sacra 1625.	Artist
Amyt Datta (born 20 October 1960) is a guitarist composer and producer from Kolkata. He is also a session musician teacher and mentor. Datta who commands a sort of demigod status with guitar fans across the country is widely acknowledged to be one of the most innovative guitarists around today. He toured extensively with the rock band Shiva from mid-1980's to the early 1990s.	Artist
Choy Weng Yang (Chinese: 蔡荣恩; pinyin: Cài Róngēn) is a Singaporean artist curator and arts writer and a proponent of the art fraternity in post-independent Singapore.	Artist
Dr. Seshulatha Kosuru is a leading Carnatic musician and teacher from Andhra Pradesh. She has performed widely in India and abroad and has received numerous awards and titles from many leading organizations. She has tuned and released many carnatic & devotional albums and has also set to tune many dance ballets.	Artist
Curt Masreliez (19 July 1919 – 21 June 1979) was a Swedish film actor. He appeared in over 50 films and television shows between 1939 and 1973.	Artist
Takahiro Konagawa (小名川 高弘 Konagawa Takahiro born November 30 1979) is a Japanese guitarist singer and musical composer from Kashiwa Chiba. He came out as a guitarist of Charcoal Filter in November 1999. While he is around as the leader of the band he has also performed as a solo singer since December 2003. His first solo album The first tears was released in July 2006.When Puffy AmiYumi recorded the song Tokyo I'm on My Way he played the guitar as an additional musician.	Artist
Christopher Benfey (born 28 October 1954) is an American literary critic and Emily Dickinson scholar. He is the Mellon Professor of English at Mount Holyoke College.	Artist
Diario segreto da un carcere femminile (internationally released as Women in Cell Block 7) is a 1973 Italian women in prison film written and directed by Rino Di Silvestro. It represents the directorial debut of Di Silvestro and the first Italian women in prison film.	Film
