Malkaridae is a small spider family with ten species in four genera.	Animal
The Dahl's toad-headed turtle (Mesoclemmys dahli) is a species of turtle in the Chelidae family.It is endemic to Colombia.	Animal
The Tersa Sphinx (Xylophanes tersa) is a moth of the Sphingidae family. It is found from the United States (Massachusetts south to southern Florida west to Nebraska New Mexico and southern Arizona) through Mexico the West Indies and Central America and into parts of South America (including Bolivia Paraguay Argentina and Brazil). An occasional stray can be found as far north as Canada.The wingspan is 60–80 mm.	Animal
Cerithiopsidella antefilosa is a species of very small sea snails marine gastropod molluscs in the family Cerithiopsidae. It was described by Bartsch in 1911.	Animal
Eupithecia jacksoni is a moth in the Geometridae family. It is found in Kenya.	Animal
Cicindela trifasciata sigmoidea commonly called the mudflat tiger beetle is a species of tiger beetle.The specimen shown in the picture was raised in captivity in Pasadena California an inland city. Its parents were captured at the Mugu Naval Base marsh in Ventura California in 2003 (for a UCLA Masters thesis). This species of tiger beetle was found to be rare in 1982 by a study conducted by the Los Angeles County Natural History Museum.	Animal
Oecomys bicolor also known as the White-bellied Oecomys or Bicolored Arboreal Rice Rat is a species of rodent in the genus Oecomys of family Cricetidae. It has a wide distribution in Amazonia occurring in northwestern Brazil northern Bolivia eastern Peru eastern Ecuador eastern Colombia much of Venezuela Guyana Suriname and French Guiana and extends into eastern Panama but it may in fact contain more than one species.	Animal
Problepsis metallopictata is a moth of the Geometridae family. It is found on Ambon Island.	Animal
Aplatissa michaelis is a species of moths of the family Hepialidae. It is endemic to Brazil.	Animal
The Puff-backed Bulbul (Pycnonotus eutilotus) is a species of songbird in the Pycnonotidae family.It is found in Brunei Indonesia Malaysia Burma Singapore and Thailand.Its natural habitat is subtropical or tropical moist lowland forests.It is threatened by habitat loss.	Animal
Lypusa tokari is a moth of the Lypusidae family. It is found in Austria Hungary northern Italy Slovakia Bulgaria Albania and in Slovakia. The habitat consists of warm grassy dry sandy habitats mainly in oak tree forests or heath.It is virtually identical in appearance to Lypusa maurella but more robust and slightly larger. It is however easily distinguished by the genitalia in both sexes.	Animal
Diagondas is a genus of jumping spiders. Its only described species Diagondas viridiaureus is found in Brazil.	Animal
Ancylosis faustinella is a species of snout moths in the genus Ancylosis. It was described by Zeller in 1867 from Palestine but is also found on Malta and in Russia as well as on the Canary Islands in Algeria Tunisia Libya Morocco Egypt Saudi Arabia Yemen Bahrain Turkey Afghanistan Syria Iran Israel Jordan Lebanon Mongolia Pakistan Niger and Sudan.Adults are small with narrow ochreous yellow forewings. It has a white costal streak and two white transverse lines.	Animal
Coregonus baicalensis is a species of freshwater whitefish in the family Salmonidae. It is endemic to the Russian Federation's Lake Baikal where it is found on the bottom (demersal). The maximum length recorded for this species is 60 centimetres (24 in). The average length is a few centimetres above 50 centimetres (20 in). It is also known as the Baikal whitefish. It is frequently considered to be a subspecies of Coregonus lavaretus.	Animal
The Yellow Glassy Tiger (Parantica aspasia) is a butterfly found in Asia that belongs to the Crows and Tigers that is the Danaid group of the Brush-footed butterflies family.	Animal
Coleophora romieuxi is a moth of the Coleophoridae family. It is found in the Democratic Republic of Congo.	Animal
Nemadactylus is a genus of morwongs.	Animal
Coleophora isomoera is a moth of the Coleophoridae family. It is found in Spain and Morocco Turkey Uzbekistan Mongolia and China.	Animal
Bredana is a genus of jumping spiders that occurs in the USA.	Animal
Lestidiops is a genus of barracudinas.	Animal
Autocrates was an Ancient Athenian poet of the old comedy. One of his plays is mentioned by Suidas and Aelian. He also wrote several tragedies. The Autocrates quoted by Athenaeus seems to have been a different person.	Animal
Seguenzioidea is a superfamily of minute to medium-sized sea snails marine gastropod mollusks in the clade Vetigastropoda.	Animal
Cryptadia is a genus of snout moths. It was described by Turner in 1913 and is known from Australia. It contains the species C. xuthobela.	Animal
Daula is a genus of moths of the Noctuidae family.	Animal
The Glossosomatoidea are a superfamily of the class Insecta and order Trichoptera.	Animal
Elaphrus smaragdiceps is a species of ground beetle in the subfamily Elaphrinae. It was described by Semenov in 1889.	Animal
The Mahomet mouse (Mus mahomet) is a species of rodent in the family Muridae.It is found in Ethiopia Kenya and Uganda.Its natural habitats are subtropical or tropical moist montane forests and subtropical or tropical high-altitude shrubland.It is threatened by habitat loss.	Animal
Kurtziella perryae is a species of sea snail a marine gastropod mollusk in the family Mangeliidae.	Animal
Choanephora is a genus of Zygomycota fungi. Choanephora species are known as plant pathogens.	Animal
Titanoceros mirandalis is a species of snout moth. It is found in China.	Animal
The Blue Duke Bassarona durga is a species of nymphalid butterfly found in the Himalayas.	Animal
The Hawaiʻi ʻŌʻō (Moho nobilis) is a member of the extinct genus of the ʻŌʻōs (Moho) within the extinct family Mohoidae. It was previously regarded as member of the Australo-Pacific honeyeaters (Meliphagidae).	Animal
The pygmy rabbit (Brachylagus idahoensis) is a North American rabbit and is one of only two rabbit species in America to dig its own burrow. The pygmy rabbit differs significantly from species within either the Lepus (hare) or Sylvilagus (cottontail) genera and is generally considered to be within the monotypic genus Brachylagus. One isolated population the Columbia Basin Pygmy Rabbit is listed as an endangered species by the U.S.	Animal
Holoterpna is a genus of moth in the family Geometridae.	Animal
The Malabar gliding frog or Malabar flying frog (Rhacophorus malabaricus) is a moss frog species found in the Western Ghats of India.	Animal
Tachymenes is a small (3 species currently recognized) afrotropical genus of potter wasps restricted to Southern Africa.	Animal
The Germain's Swiftlet (Aerodramus germani) is a species of swift.It is found in China Indonesia Laos Malaysia Myanmar the Philippines Singapore Thailand and Vietnam. Its natural habitats are subtropical or tropical moist lowland forests and subtropical or tropical moist montane forests.	Animal
Sturisoma kneri is a species of armored catfish endemic to Venezuela where it occurs in the Lake Maracaibo drainage. This species grows to a length of 23.89 centimetres (9.41 in) SL.	Animal
Serpulorbis inopertus is a species of sea snail a marine gastropod mollusk in the family Vermetidae the worm snails or worm shells.	Animal
Argyresthia annettella is a moth of the Yponomeutidae family. It is found in North America including Ohio Ontario and Quebec.The wingspan is about 9 mm. The forewings are silvery white with a pale golden crookedfascia from the base of the costa to the basal third of the dorsal edge. There is a broad golden fascia on the middle of the wing. There is also an irregular inwardly curved golden fascia slightly furcate at the costal edge and at the apical third.	Animal
Asura carnea is a moth of the Arctiidae family. It is found in China.	Animal
Bullia natalensis the pleated plough shell is a species of sea snail a marine gastropod mollusk in the family Nassariidae the Nassa mud snails or dog whelks.	Animal
Thelycera is a genus of moth in the family Geometridae.	Animal
Buccinum hydrophanum is a species of sea snail a marine gastropod mollusk in the family Buccinidae the true whelks.	Animal
Pararguda is a genus of Moth in the family Lasiocampidae.	Animal
Wheeleria raphiodactyla is a moth of the Pterophoridae family. It is found in Portugal Spain and France.The wingspan is 22–24 millimetres (0.87–0.94 in).	Animal
Scopula crassipuncta is a moth of the Geometridae family. It is found in Angola.	Animal
Carposina engalactis is a moth in the Carposinidae family. It was described by Meyrick in 1932. It is found in Brazil.	Animal
Camptosomata are the case-bearing leaf beetles or camptosomates named for their habit of carrying a case of waste material as larvae. This group consists of two subfamilies of Chrysomelidae (leaf beetles): Lamprosomatinae and Cryptocephalinae (which include the former Chlamisinae and Clytrinae).Each case begins as a wrapping that the mother creates by laying plates of fecal material around each egg. She begins at one end of the egg and turns it with the addition of each plate.	Animal
The Black-headed Shrike-babbler (Pteruthius rufiventer) is a bird species traditionally placed with the Old World babblers in the family Timaliidae. However it might be one of the few Eurasian vireos (Vireonidae).It is found in India Bhutan Tibet Myanmar Nepal and Vietnam. Its natural habitat is subtropical or tropical moist montane forests.	Animal
Netechma labyrinthica is a species of moth of the Tortricidae family. It is found in Ecuador (Tungurahua Province).	Animal
Atelopus quimbaya is a species of toad in the Bufonidae family.It is endemic to Colombia.Its natural habitats are subtropical or tropical moist montane forests and rivers.	Animal
Eulima compsa is a species of sea snail a marine gastropod mollusk in the family Eulimidae. The species is one of multiple known species to exist within the genus Eulima.	Animal
Statherotis is a genus of moths belonging to the subfamily Olethreutinae of the family Tortricidae.	Animal
The African linsangs also known as Oyans are two species classified in the mammalian subfamily Viverrinae in the family Viverridae. There is one genus Poiana.Both linsang genera (Poiana and the Asian Prionodon) were formerly placed in the subfamily Viverrinae (of Viverridae) along with several other genera but recent research suggests that their actual relationships may be somewhat different.	Animal
Dendronephthya klunzingeri is a species of soft coral in the family Nephtheidae.This species is divaricate with discontinuous contours. Each bundle has 10 to 12 polyps. The branching lobes have sizable bunches.	Animal
The Grey-and-buff Woodpecker (Hemicircus concretus) is a species of bird in the Picidae family.It is found in Brunei Indonesia Malaysia Myanmar Singapore and Thailand.Its natural habitats are subtropical or tropical moist lowland forests and subtropical or tropical moist montane forests.	Animal
The Yellow-legged Tinamou (Crypturellus noctivagus) is a species of tinamou found in wooded and shrubby habitats in tropical and subtropical eastern Brazil. This superficially quail-like bird has a grey-brown plumage and two easily separated subspecies. It has declined due to human activities and is therefore listed as Near Threatened by the IUCN.	Animal
Rhescyntis is a genus of moths in the Saturniidae family.	Animal
The Northern White-crowned Shrike or White-rumped Shrike (Eurocephalus rueppelli) is a shrike found in dry thornbush semi-desert and open acacia woodland in east Africa from southeastern Sudan and southern Ethiopia to Tanzania. Its binomial name commemorates the German naturalist and explorer Eduard Rüppell.	Animal
The Indian Cupid (Chilades parrhasius) is a small butterfly that belongs to the Lycaenids or Blues family. It is found from Sri Lanka and India to southern Iran central and eastern Saudi Arabia the United Arab Emirates Yemen and Oman.	Animal
Lissotesta gittenbergeri is a species of sea snail a marine gastropod mollusk unassigned in the superfamily Seguenzioidea.	Animal
Lasioderma hemiptychoides is a species of beetles in the genus Lasioderma of the family Anobiidae.	Animal
Hypselodoris rosans is a species of colourful sea slug or dorid nudibranch a marine gastropod mollusk in the family Chromodorididae.	Animal
William B. Black was the Republican member of the Illinois House of Representatives representing the 104th district from 1986 until 2011. He was the Deputy Republican Leader.In 2007 Black had announced his plans to retire at the end of that term but he entered the race for re-election after the Republican nominee Scott Eisenhouer withdrew his candidacy. In November 2008 Black is re-elected to office defeating Democrat Lori DeYoung of Fithian Illinois.	OfficeHolder
Martha Van Rensselaer (June 21 1864 – May 26 1932) was a founding co-director of Cornell University’s New York State College of Home Economics now the New York State College of Human Ecology and served as an educator and leading proponent of applying science to improve the quality of life in the home. She called this new field “domestic science” using rigorous scientific research to understand and improve many key aspects of homemaking.	OfficeHolder
Sir Nevile Meyrick Henderson KCMG (10 June 1882 – 30 December 1942) was the third child of Robert and Emma Henderson and was born at Sedgwick Park near Horsham West Sussex. He was educated at Eton College and joined the Diplomatic Service in 1905. He was Ambassador of Great Britain to Germany from 1937 to 1939 and believed that Adolf Hitler could be controlled and pushed toward peace and cooperation with the Western powers.	OfficeHolder
Charles Thomson Ritchie 1st Baron Ritchie of Dundee PC (19 November 1838 – 9 January 1906) was a British businessman and Conservative politician who sat in the House of Commons from 1874 until 1905 when he was raised to the peerage. He served as Home Secretary from 1900 to 1902 and as Chancellor of the Exchequer from 1902 to 1903.	OfficeHolder
V. V. Rajan Chellappa is an Indian Politician and incumbent Mayor of Madurai Corporation. As a cadre of All India Anna Dravida Munnetra Kazhagam party he previously served as a member of Rajya Sabha. from 1992 - 1998.AIADMK's V.V. Rajan Chellappa who polled 312226 votes defeated his nearest rival P. Packianathan of the DMK who secured 138329 votes for Madurai Mayor in October 2011.	OfficeHolder
Pat Breen (born 21 March 1957) is an Irish Fine Gael politician. He has been a Teachta Dála (TD) for the Clare constituency since 2002.Having been a member of Clare County Council and the Vocational Educational Committee from June 1999 to 2002 Breen was first elected to Dáil Éireann at the 2002 general election.	OfficeHolder
Marike de Klerk (17 November 1937 – 4 December 2001) was the First Lady of South Africa as the wife of State President Frederik Willem de Klerk from 1989 to 1994. She was also a politician of the former governing National Party in her own right.	OfficeHolder
James McCosh Clark (12 August 1833 – 26 January 1898) was Mayor of Auckland in the 1880s. He was a successful businessman until many of his ventures failed during the depression of the 1880s which caused him to return to England for the last decade of his life. He was the son of Archibald Clark.	OfficeHolder
Linda Runbeck (born June 11 1946) is a Minnesota politician and member of the Minnesota House of Representatives. A member of the Republican Party of Minnesota she represents District 38A which includes all or portions of Anoka and Washington counties in the northern Twin Cities metropolitan area. She and her husband are also co-owners of Braham Monument Company in Braham.	OfficeHolder
William Mayrant (March 8 1765 – January 23 1832) was a U.S. Representative from South Carolina.William Mayrant was elected in 1814 as a Democratic-Republican to the Fourteenth Congress and served until his resignation on October 21 1816 (March 4 1815-October 21 1816). He was elected to his first and only term as a member of the US House of Representatives from his home at Stateburg near what is now Sumter SC. He represented South Carolina's 9th congressional district.	OfficeHolder
Eduardo Georgetti (October 11 1866 – 1937) was an agriculturist businessman philanthropist and politician. Georgetti who came from a family of prosperous land owners became one of Puerto Rico's wealthiest sugar barons and benefactors. In 1917 he became the first Vice-president of the Puerto Rican Senate.	OfficeHolder
Ezlynn Deraniyagala (1908 – 1973) was a Sri Lankan barrister and feminist who was the first female Sri Lankan barrister. She was the long-time president of the All-Ceylon Women's Conference and served as the 5th President of the International Alliance of Women from 1958 to 1964.	OfficeHolder
José da Câmara Teles (1712;Lisbon-1757;Lisbon) member of the Azorean dynastic Gonçalves da Câmara family he was son of Luís Manuel da Câmara third Count of Ribeira Grande and made 13th Donatary-Captain of the island of São Miguel following his father's death (who never received the title directly). An absentee captain hew was forced to return to the island by the King.	OfficeHolder
Sir Brenton Halliburton (December 27 1774 – July 16 1860) was the eighth Chief Justice of the Supreme Court of Nova Scotia. His portrait was done in 1849 by Albert Gallatin Hoit. Nova Scotian artist William Valentine painted Haliburton's portrait.	OfficeHolder
Brian S. King is an American politician and a Democratic member of the Utah House of Representatives representing District 28 since January 1 2009.	OfficeHolder
William Henry Thompson (December 14 1853 – June 6 1937) was a Nebraska Democratic Party politician.Born in Perrysville Ohio he attended Upper Iowa University in Fayette Iowa from 1872 to 1875 then graduated from the University of Iowa law school in 1877 being admitted to the bar the same year. He started practicing law in what was then known as Brush Creek Iowa but is now known as Arlington Iowa. He moved to Grand Island Nebraska in 1881 practiced law and did some banking as well.	OfficeHolder
Mem de Sá (c. 1500 – 2 March 1572) was a Governor-General of the Portuguese colony of Brazil from 1557-1572.He was born in Coimbra Kingdom of Portugal around 1500 the year of discovery of Brazil by a naval fleet commanded by Pedro Álvares Cabral. He was nominated the third Governor-General of Brazil in 1556 succeeding Duarte da Costa who was Governor-General from 1553 to 1557. The seat of the government was Salvador in the present-day state of Bahia.	OfficeHolder
Charles Calhoun Charlie Dail (January 11 1909–July 13 1968) was an American Democratic politician from San Diego California. He served three terms on the San Diego City Council and two terms as the 27th Mayor of San Diego.	OfficeHolder
George Prudham PC (February 27 1904 – August 24 1974) was a Canadian politician.Born in Kilbride Ontario he was elected to the Canadian House of Commons representing the riding of Edmonton West in the 1949 federal election. A Liberal he was re-elected in 1953. In 1950 he was the Parliamentary Assistant to the Minister of Resources and Development. From 1950 to 1957 he was the Minister of Mines and Technical Surveys.	OfficeHolder
Edward Richard Russell 1st Baron Russell of Liverpool (9 August 1834 - 20 February 1920) was a British journalist and Liberal politician.Russell was a newspaper man who also involved himself in politics. Born in London he was largely self-made rising to become Editor of the Liverpool Daily Post a position he held for almost fifty years. He is reputed to have been a man of great ability with high religious and moral standards.	OfficeHolder
Prematilaka Mapitigama also known as K. W. M. P. Mapitigama (January 7 1930 – April 14 2012) (Sinhala: ප්‍රේමතිලක මාපිටිගම) was a senior Sri Lankan civil servant author and a publisher. As the Secretary to President J. R. Jayewardene Mapitigama was one of the highest ranking public servants in the government of Sri Lanka. At the time of his death he was serving as the Secretary General of J.R. Jayewardene Center at 191 Dharmapala Mawatha Colombo 7. Mapitigama succeeded W.M. P. B.	OfficeHolder
Mark Leonard Litchman Jr. (born April 14 1925) is a former politician in the American state of Washington.Born in Seattle he is the son of prominent lawyer Mark M. Litchman. He attended the University of Washington in sociology and with an LL.B. A veteran of the United States Navy he is an attorney and former president of a real estate firm.Litchman was elected to the Washington House of Representatives in 1955 for district 45 (parts of King County) as a Democrat. He served until 1973.	OfficeHolder
Joel J. Johnson (March 30 1923 – April 6 2009) is a former Democratic member of the Pennsylvania House of Representatives.	OfficeHolder
Edward John Littleton 1st Baron Hatherton PC FRS (18 March 1791 – 4 May 1863) was a British politician of first the Canningite Tories and later the Whigs. He had a long political career active in each of the Houses of Parliament in turn over a period of forty years. He was closely involved in a number of major reforms particularly Catholic Emancipation the Truck Act of 1831 the Parliamentary Boundaries Act 1832 and the Municipal Corporations Act 1835.	OfficeHolder
Howard Russell Pawley PC OC OM (born November 21 1934) is a Canadian politician and professor who was the 18th Premier of Manitoba from 1981 to 1988.	OfficeHolder
Barbara J. Barb Goodwin (born January 25 1949) is a Minnesota politician and member of the Minnesota Senate. A member of the Minnesota Democratic–Farmer–Labor Party (DFL) she represents District 41 which includes portions of Anoka Hennepin and Ramsey counties in the northern Twin Cities metropolitan area.	OfficeHolder
Luis Bárcenas Gutiérrez (born October 22 1957 in Huelva Spain) is a Spanish politician in the Partido Popular (PP People's Party). A former senator and party Treasurer he has been embroiled in political corruption scandals and was imprisoned in 2013 pending trial.	OfficeHolder
Richard A. Davey is an American attorney and transportation executive who has served as the Massachusetts Secretary of Transportation since September 2 2011.	OfficeHolder
Dr. Lee Boon Yang (simplified Chinese: 李文献; traditional Chinese: 李文獻; pinyin: Lǐ Wénxiàn; Pe̍h-ōe-jī: Lí Bûn-hiàn; born 1 October 1947) is a former Singaporean politician. A member of the governing People's Action Party (PAP) he served in the Cabinet from July 1991 to April 2009 in various portfolios including Minister for Defence Minister for Manpower and Minister for Information Communications and the Arts. He was also a Member of Parliament (MP) for Jalan Besar GRC from 1984 to 2011.	OfficeHolder
Arumugam Sinnaththurai Thurairajah Raviharan is a Sri Lankan Tamil politician and provincial councillor.Raviharan contested the 2013 provincial council election as one of the Tamil National Alliance's candidates in Mullaitivu District and was elected to the Northern Provincial Council. After the election he was appointed to assist the Minister of Fisheries Transport Trade and Rural Development on fisheries. He took his oath as provincial councillor in front of Chief Minister C. V.	OfficeHolder
Gilles Pouliot (born May 25 1942) is a former politician in Ontario Canada. He served as a member of the Ontario legislature from 1985 to 1999 representing the Northern Ontario riding of Lake Nipigon for the New Democratic Party.	OfficeHolder
Christopher Campbell Ward (born June 21 1949) is a former politician in Ontario Canada. He served in the Legislative Assembly of Ontario as a Liberal from 1985 to 1990 and was a cabinet minister in the government of David Peterson.	OfficeHolder
Habib Bourguiba (Arabic: الحبيب بورقيبة‎ Ḥabīb Būrqībah; full name: Habib Ben Ali Bourguiba; 3 August 1903 – 6 April 2000) was a Tunisian statesman who became the country's first President of the Republic of Tunisia from 25 July 1957 to 7 November 1987.Having worked as a lawyer in France in the 1920s he returned to Tunisia and started being more active in the country's nationalist movement.	OfficeHolder
Benjamin Ruggles (February 21 1783 – September 2 1857) was a National Republican and Whig politician from Ohio. He served in the U.S. Senate.	OfficeHolder
Toussaint Pothier (May 16 1771 – October 22 1845) was a businessman seigneur and political figure in Lower Canada.He was born Jean-Baptiste Pothier in Montreal in 1771 the son of Louis-Toussaint Pothier a merchant and one of the founders of the North West Company. He worked for the Michilimackinac Company a fur trading company and later for its successor the South West Fur Company.	OfficeHolder
Brian K. Krolicki (born December 31 1960) is an American politician. He is the 33rd and current Lieutenant Governor of Nevada elected in 2006. As the Lieutenant Governor he presides over the Nevada State Senate chairs the Commission on Tourism and serves on the State Board of Transportation and the Reno Tahoe Winter Games Coalition. Previously he served two terms as the Nevada State Treasurer. He is a member of the Republican Party.	OfficeHolder
Marie Montpetit is a Canadian politician in Quebec who was elected to the National Assembly of Quebec in the 2014 election. She represents the electoral district of Crémazie as a member of the Quebec Liberal Party.Prior to her election to the legislature Montpetit worked for the provincial Ministry of Health and Social Services and the World Health Organization.	OfficeHolder
Salim Hemed Khamis (born 20 September 1951 – 28 March 2013[citation needed]) was a Tanzanian CUF politician and Member of Parliament for Chambani constituency since 2010.	OfficeHolder
