question: How many conductors are present in the bulb's base? [SEP] sentence: Contact wires and a base with two (or more) conductors provide electrical connections to the filament.	entailment
question: Who raised Victoria? [SEP] sentence: Both the Duke of Kent and King George III died in 1820, and Victoria was raised under close supervision by her German-born mother Princess Victoria of Saxe-Coburg-Saalfeld.	entailment
question: How long are all the public beaches together in miles? [SEP] sentence: New York City has over 28,000 acres (110 km2) of municipal parkland and 14 miles (23 km) of public beaches.	entailment
question: The change in universities towards the completion of the early modern period is credited with the formation of what entity? [SEP] sentence: The hierarchical place of theological knowledge had for the most part been displaced and the humanities had become a fixture, and a new openness was beginning to take hold in the construction and dissemination of knowledge that were to become imperative for the formation of the modern state.	entailment
question: Why was tin was rarely used for everyday use? [SEP] sentence: As a pure metal, tin was much too soft to be used for any practical purpose.	entailment
question: What is Dr. Yashwant Singh Parmar University earned? [SEP] sentence: Dr. Yashwant Singh Parmar University of Horticulture and Forestry has earned a unique distinction in India for imparting teaching, research and extension education in horticulture, forestry and allied disciplines.	entailment
question: What was the time span of the Roman Republic? [SEP] sentence: During the Roman Republic (509–27 BC), the same men who were elected public officials might also serve as augurs and pontiffs.	entailment
question: What state is achieved through knowledge? [SEP] sentence: Moksha (liberation), it states, is gained through right knowledge.	entailment
question: Who was known for focusing on the environment in the 1960s? [SEP] sentence: Sustainability in architecture was pioneered by Frank Lloyd Wright, in the 1960s by Buckminster Fuller and in the 1970s by architects such as Ian McHarg and Sim Van der Ryn in the US and Brenda and Robert Vale in the UK and New Zealand.	entailment
question: Which actor also attended the celebrations? [SEP] sentence: The torch arrived in Sanya, Hainan on May 4 with celebrations attended by International Olympic Committee (IOC) officials and Chinese big names like Jackie Chan.	entailment
question: How many people protested on February 23? [SEP] sentence: On February 20, a 30,000-strong crowd demonstrated in Theater Square, by February 22, there were 100,000, the next day 300,000, and a transport strike was declared, by February 25, there were close to 1 million demonstrators – about a quarter of Armenia's population.	entailment
question: What did Ehrenstein say Obama does for white people? [SEP] sentence: Ehrenstein went on to say "He's there to assuage white 'guilt' they feel over the role of slavery and racial segregation in American history."	entailment
question: Under the Drug Kingpin Act of 1988 and Federal Death Penalty Act of 1994, about how many crimes were punishable by death? [SEP] sentence: Congress acted defiantly toward the Supreme Court by passing the Drug Kingpin Act of 1988 and the Federal Death Penalty Act of 1994 that made roughly fifty crimes punishable by death, including crimes that do not always involve the death of someone.	entailment
question: What was Stop Hinkley [SEP] sentence: A protest group, Stop Hinkley, was formed to campaign for the closure of Hinkley Point B and oppose any expansion at the Hinkley Point site.	entailment
question: The Concodat restored significant power to what position? [SEP] sentence: While the Concordat restored much power to the papacy, the balance of church-state relations had tilted firmly in Napoleon's favour.	entailment
question: In which period did Gellius gain fame? [SEP] sentence: Gellius became a favorite author in the Italian Renaissance, and, in fifteenth-century Italy, teachers and scholars of philosophy, poetry, and rhetoric were called and called themselves "humanists".	entailment
question: How is The Bahre-Nagassi translated? [SEP] sentence: The Scottish traveler James Bruce reported in 1770 that Medri Bahri was a distinct political entity from Abyssinia, noting that the two territories were frequently in conflict.	not_entailment
question: How close to the line of scrimmage can defensive players approach before a play is run? [SEP] sentence: The defending team must stay a yard or more back from the line of scrimmage.	not_entailment
question: In what month and year did Gaddafi make a speech promoting economic privatization? [SEP] sentence: In 2010, plans were announced that would have seen half the Libyan economy privatized over the following decade.	not_entailment
question: How many containers can Longtan Containers Port Area handle? [SEP] sentence: As of 2010, it operated six public ports and three industrial ports.	not_entailment
question: When did John make his first visit to Ireland? [SEP] sentence: John's first period of rule in Ireland was not a success.	not_entailment
question: What organism produces mevastatin? [SEP] sentence: Animal trials showed very good inhibitory effect as in clinical trials, however a long term study in dogs found toxic effects at higher doses and as a result mevastatin was believed to be too toxic for human use.	not_entailment
question: When did Kerry and his wife divorce? [SEP] sentence: After 14 years as a political wife, I associated politics only with anger, fear and loneliness" she wrote in A Change of Heart, her book about depression.	not_entailment
question: When was the Anglo -Russia Entente signed? [SEP] sentence: The immediate origins of the war lay in the decisions taken by statesmen and generals during the July Crisis of 1914, the spark (or casus belli) for which was the assassination of Archduke Franz Ferdinand of Austria.	not_entailment
question: Who was the general who spoke out against the USSR joining NATO? [SEP] sentence: He opposed the request to join NATO made by the USSR in 1954 saying that "the Soviet request to join NATO is like an unrepentant burglar requesting to join the police force".	not_entailment
question: What sorts of people are more likely to be emotionally expressive? [SEP] sentence: According to some theories, they are a state of feeling that results in physical and psychological changes that influence our behavior.	not_entailment
question: How many graphemes does Czech have? [SEP] sentence: Czech has one of the most phonemic orthographies of all European languages.	not_entailment
question: What was the name of Beyonce's daughter? [SEP] sentence: Blue Ivy's cries are included at the end of the song, and she was officially credited as "B.I.C." on it.	not_entailment
question: What kind of words does Catalan have few of? [SEP] sentence: Thus, Catalan has noi/noia ("boy"/"girl") and gall/gallina ("cock"/"hen"), whereas French has garçon/fille and coq/poule.	not_entailment
question: How recently were voluntary standards of pesticide regulation updated? [SEP] sentence: To deal with inconsistencies in regulations among countries, delegates to a conference of the United Nations Food and Agriculture Organization adopted an International Code of Conduct on the Distribution and Use of Pesticides in 1985 to create voluntary standards of pesticide regulation for different countries.	not_entailment
question: In which four countries were the impacts of avant garde art particularly strong? [SEP] sentence: Though there are many points of intersection between Cubism and architecture, only a few direct links between them can be drawn.	not_entailment
question: What two ideas did conservative and clerical defenders of traditional religion attack as evil forces that encouraged immorality? [SEP] sentence: As the Enlightenment was ending, Romantic philosophers argued that excessive dependence on reason was a mistake perpetuated by the Enlightenment, because it disregarded the bonds of history, myth, faith and tradition that were necessary to hold society together.	not_entailment
