title: Not good [SEP] content: Did not like the book really boring might be a classic .but I'm to good for this horrid book sorry	negative
title: Musical suprise of 2004 [SEP] content: So much hate for the ex Miss Universe I see. Why? This is a solid pop/rock effort and Alicia is one of the biggest musical surprises of 2004. She's got a lovely voice, think María Conchita Alonso meets Lisa Marie Presley. The best track on this album has to be EL PAÍS DE LAS MARAVILLAS. I can not begin to tell you how many times I listen to this song! It should have been the first single. Really give her a chance. Some great songs. I hope to God she records a follow up.	positive
title: Clay and Ruben fan [SEP] content: I think Ruben's cd is great - very easy to listen to and sing along with. He really pulls you into it. I voted for Clay during AI but bought both the cd's and will support both of these talented young men.	positive
title: pretty good cover [SEP] content: This is not a flimsy vinyl plastic cover nor is it leather-like coverage - its in-between and just right. It fits my classic road bike very well and provides coverage all the way down to the ground almost even though I have a tall 27 inch frame. I'm not too enamoured about leaving my bike outside, as I am concerned about accelerating its rusting. We'll see how this works out. Otherwise, this cover is a good value for the money, fits properly and will keep away the bad weather. Perhaps a fully zippered breathe-able fabric cover might be the best? I have not seen one. Lacking that, this one is a very good one and definitely worth the $20.	positive
title: My 2 Year Old Loves It! [SEP] content: We got this for my daughter as a Christmas gift, she won't even be 2 years old until January. I decided to let her open it early, just to see if I should buy furniture for it or not. She hardly ever plays with anything more than 5 minutes, but this holds her attention for hours at a time. She loves it. She talks to them and makes them interact with each other. The house is made very well too, she likes to stand on the bottom floor and it holds her! I bought her some more people and another horse for it. I still can't believe how good she is doing with it. I'm sure it will be her favorite toy for quite some time!	positive
title: THE BEST SALES BOOK IN THE WORLD [SEP] content: I got into the sales line recently. Badly needing advice on how to succeed in it, I have read a couple of sales books. But I don't seem to learn much and was not at all inspired by them. Until, I discovered this book by Frank Bettger. Reading this book, I found Frank a very sincere person, one happy to pass on all the successful sales experiences he had garnered to readers.No doubt about is. This is the best sales book in the world. Any reader will benefit tremendously from it.	positive
title: Inspirational Book for anyone interested in mosaic-ing [SEP] content: I bought this for my sister-in-law who started doing mosaics but had no reference material. She loves it! Kaffe has an eye for colour and design that can't be faulted, and the instructions are clear and easily followable. There are a range of projects suitable for your home, or gifts. Great book, and I am in the good books with my sister-in-law!	positive
title: Beautiful [SEP] content: This cd is composed of all the background music to the incredible anime series, Rurouni Kenshin. There are 2 vocal tracks on here, Sobakasu-The Opening Theme, and Tears Know-one of the ending songs. The music is absolutley gorgeous, this is one of the few anime series that has great music. This really is a cd that you will want to add to your collection.	positive
title: Strong argument for the impossible [SEP] content: We know that the media is left-wing ; everybody knows that, right? Not Eric Alterman and he'll tell you why the media is far more conservative than you think. While I think he overstates his case, this is an excellent, well-researched book.I don't think he'll change too many minds,as people who are convinced the media is liberal are not going to change their minds just by reading a book, even such a persuasive one as What Liberal Media.I would ask any readers of this book to read this with an open mind and perhaps you might come around to Alterman's point of view.	positive
