title: Funny [SEP] content: Best show on television. With the rest of the television becoming reality tv, it is good to see something well writtten, funny and no canned laughter.	positive
title: Organic bar with good taste and texture [SEP] content: This is one of the better tasting bars I've tried, but as always, your mileage may vary. For the most part, I'm not a huge fan of "nutty" bars, but this is an exception. While not packed with blueberries, the taste does come through, with just enough sweetness and a nice texture compared to many other bars that can be either too chewy or cakey. The organic ingredients are nice and this is certainly a good sweet-tooth alternative to candy bars and many of the other "energy" bars on the market that are packed with sugars. I think these would be great to carry along on a hike or other day outing where you want something quick. I'll be purchasing more of these.	positive
title: Great MP3; Needs work on the video and shuffle play flexibility [SEP] content: This ipod is great for storing your entire CD collection and still have plenty of space for your latest 100-2000 pictures to share with family and friends. I would like to see some improvements from Apple on the following:1. Video quality - the screen is small and the quality is not real great especially in fast moving action shots2. Must use iTunes - This is sad because there are better applications out there3. Shuffle Play is limited - It is difficult to set a shuffle play for anything smaller than the entire ipod or a playlist. For 2 - 4 GB that works ok, but when you have your entire CD collection loaded up, it is difficult to just play a particular Genre or even artist.	positive
title: Carcassonne The River 2 [SEP] content: I cannot play without the River 2. It adds a whole new dynamic competitiveness to start each game. A must have	positive
title: loves to read [SEP] content: The book is a very good read for anyone who likes drama mixed with romance. Altho most of the time I could predict where the plot was going, it was still very interesting to see how the author delt with it. I would recommend this book to anyone who likes suspense.	positive
title: This spectacle is truly fantastic. [SEP] content: To experience Alejandro Sanz, you need to see where he`s comming from. for those who didn`t know who Sanz was before the unplugged, this is a great chance to see what is all about. This concert take place in Barcelona, and you can see his "Tour Mas" one of the biggets points in his career. take the opportun ity to see him live, and to discover the real Alejandro on stage.	positive
title: Interesting, well-written! [SEP] content: Greatly enjoyed learning about the history of zero and loved Kaplan's writing style. His enthusiasm for this topic is clear throughout the book and he keeps the topic interesting and dynamic, rather than reverting to a textbook format.	positive
title: Great help with plantar fasciitis! [SEP] content: This support and the night split fixed my plantar fasciitis when nothing else did. Highly recommended! Buy this!	positive
title: Enjoyable Small Group Swing [SEP] content: Until I heard this cd, I never made the association of the similarities of playing and tone between Pete Fountain and Benny Goodman. I suppose this impression is further enhanced by some of the selections ("Oh, Lady Be Good", "Avalon", "Shine" and "Rosetta" for example) and the small group consisting of unidentified xylophone (reminding me of Red Norvo), guitar, bass and drums.Except for two obvious selections , there is nothing to identify this with New Orleans but this is still a very enjoyable small group swing set.	positive
title: Awesome sweeper for pet hair! [SEP] content: I absolutely love this sweeper. I keep it charged all the time and use whenever there is anything to pick up. It actually picks up pet hair better than my vacuum cleaners.	positive
title: Fascinating [SEP] content: This a very interesting book, and will give you information you probably never knew... some entries are a little glossed over, but for the most part it will keep you busy for a while. It doesn't discuss information from the the most recent novels (Like the 2nd Han Solo Trilogy) or the Phantom Menace of course, but oh well.	positive
