title: Gets an absolute beginner up and running. [SEP] content: This book is aimed at those who are completely new to Access. It will systematically, for the most part, allow a beginner to become familiar with Tables, Forms, Queries,etc... Good examples, CD contains video examples as well. If your new to Access and want to be held by the hand then buy this book.	positive
title: perfect [SEP] content: this coffee maker travels with me everywhere. it is well made and the extra shot a great hidden gem. buy it!	positive
title: Reply To Music Man from the UK or something along that line [SEP] content: the song they sing on the bus is "tiny dancer" by elton john where they all start joining in, hope this helped you	positive
title: A Role-Play Specific Doll - Great for the Ballerina Baby Girl [SEP] content: This was another Christmas gift for our 3-year-old daughter, who began taking ballet lessons this past fall. She was very specific about the Barbie she wanted, and it was this one.The Barbie is very articulated (knee and foot positions) which is probably better enjoyed by the older ballet and Barbie fan. Our daughter is younger and has more fun with Kelly spinning to the music, and the fact that one can hold Barbie by the crown on top and spin her as well. The ballet barre and bag haven't caught her eye; it's the dancing Kelly. Because the ballet shoes are molded onto both dolls' legs, these cannot be dressed up like other Barbie and Kelly dolls. These two beautiful dolls are specific to the ballet role-play.	positive
title: Wonderful Storytelling! [SEP] content: Jim Dale does a fun and incredible job as narrator of the Harry Potter books. After listening to Sorcerer's Stone I immediately picked up the rest of the series. I admire how he comes up with different accents for the many characters. I even ordered the UK version from ..., and nice as those are, I think Jim Dale's version takes the cake - or pumpkin pasties!	positive
title: Beautiful Picture [SEP] content: I have been looking for this blu-ray for my husband for some time. It hasn't been in any store I have looked and every else online had outrageous prices. I am so happy I looked on Amazon before giving up. We popped it in our PS3 and the picture is absolutely phenomenal. I even ended up watching it with him.	positive
title: Do not use a generic battery! [SEP] content: I want to point out that you should never buy a generic battery, like the person from San Diego who reviewed the S410 on May 15, 2004, was recommending. Yes you'd save money, but there have been many reports of generic batteries exploding when charged for too long. And don't think if your generic battery explodes you can sue somebody and win millions. These batteries are made in sweatshops in China, India and Korea, and I doubt you can find anybody to sue. So play it safe, both for your own sake and the camera's sake. If you want a spare, get a real Canon one.	positive
title: Best new Handheld System than Sony's PSP [SEP] content: I think it is cool for Nintendo to make this new Handheld System great for Fans of Nintendo. I mean the Reason why I said this is better than The Playstation Portible (Sony's 1st handheld system) because Sony doesn't know what the heck there making I mean Nintendo made more Games for the DS than Sony because Sony is making a little bit of Games for the PSP but I betcha the DS is going to be better.	positive
title: ok [SEP] content: These were quite heavy. My son said his feet sweat when he wore them with his boots. So he wears them around the house instead of slippers. They have held up to many washings. I would recommend them.	positive
title: A must buy [SEP] content: Having no idea what to expect before going to my first Rebecca's Statue show, I asked around. "Like Phish, but more bluesy.", some said. "Highly inspirational", a rollicking young hipster blurted out. The Statue was all these things, and then some. But could they make an album? Many spectacular live bands have trouble going from the live world to the studio world. Well simply put, they got it taken care of. This album ranks high among my favorites. The Statue is one of those bands that has so many influences it would be impossible to name a few bands or styles as their influence. All I can say is that I've played this CD for fans of jazz, blues, hard rock, pop, and bluegrass, and all of those people have bought "Drinking From the Water Clock", or gone to a Statue show. You will not be disappointed with this disc.	positive
title: snow treasure [SEP] content: This was a gift for my 2nd grade Grandson. He is an advanced reader, and we constantly set the goals for him. I read this the first time at age 28, and it was the start of my reading journeys	positive
title: This is the best music in the world [SEP] content: i loved this tape, i listen to it all the time and hope that bruce springstein lives a long and happylife, amen	positive
title: As creative and colorful as the subtitle says! [SEP] content: If you like felt crafts, you're sure to love this book. From practical to whimsical, from cute to wild, these crafts offer something for everyone. There are frames, banners, pillows, accessories, toys, and more. One project offers an amazing new take on felt: using a woodburning tool to create a Celtic banner. You might not need to make these projects - the book is presented so well, you can browse it like an art book! You're sure to come away smiling.	positive
title: Brash [SEP] content: I bought this album because I broke the first one (it was literally smashed during a move and in 3 pieces). I didn't hesitate to replace this album because it's so great. I hope I don't break this one but if I do, I'll replace it again.	positive
title: Good movie all around! [SEP] content: I bought this for myself a short time ago and I love it. An excellent piece for my movie collection.	positive
title: The Classic [SEP] content: If you grew up on N64 and Still love gaming: You will still love Mario Kart 64. Play This game.	positive
title: PLUS WHAT???? [SEP] content: I am a huge YES fan. I had this on pre-order, and I would like to knowwhat the difference is from the same item that was released in 2006??Same booklet (almost), the 2006 release is Same format, 2 DVD'sand has bonus material this one don't have. Search for "An evening of YesMusic Plus". The one released Aug 2007 is this single DVD version with'PLUS Nothing". It is missing the Bonus material, including the last twosongs.Everything else appears to be identical. Format, Sound. Why do they dothis? I don't understand. Well, back it goes. I have the 2 DVDAn Evening of Yes Music Plus"Evening of YES MusicPlus" with Plus. Then again, I have to give it 1 more star if youfigure the tiny bit more "Plus" you get is $48, verses $13 for this one...	positive
title: A Fresh Sound to a Point. . . [SEP] content: With some of the same tone and feeling as Nik Bärtsch's Ronin modal improvisations, this album of the postmodern avant-garde trio The Bad Plus demonstrates why they were selected for the recent album of Disney covers, Everybody Wants to Be a Cat. Their deconstruction of familiar tunes and their own compositions (three by bassist Anderson, two by drummer King, and one by pianist Iverson) are energetic and often noisy. Each musician is a percussionist, each a melody maker. The scratchy, nervous music may be jarring to many, but others may appreciate the cleverness, humor, and audacity. The lyricism between the discord, as with track 5, Giant, arises as a fresh breeze. The well-matched team of musicians create a fresh, bright and challenging sound. The problem is that repeated listening tarnishes that brilliance. The musical approach soon seems to be only a gimmick.	positive
title: Perfect Diversion- Beachside read! [SEP] content: Danielle Steele writes another diversionary read with a fun happy ever after ending! I love this kind of book for a quick mental getaway. Read it in one sitting and think of it as the perfect style writing for women who just need a quick fun pick up. Entertaining and fun to read.	positive
title: Robbie Shaw's BOEING 747: Great Book for 747 Fans! [SEP] content: This book is the greatest Boeing 747 book I have read so far; I have my own copy and I never tire of looking through it and admiring the great photos and detailed captions telling the whole story of the particular aircraft pictured, including its name, tail number, previous owners, etc. I also love the text; it is a great history of all the series of 747s: -100, -200, cargo, SP, -300, and -400. Some of my favorite photos are of a TWA 747-100, the Pan Am 747s, the SPs, and the Aer Lingus 747-100. The only things that are missing that I'd like to see are "classic" 747s (Delta, American, Braniff, National, etc) and interior shots. Otherwise, an A-1 747 book for Jumbo fans like me!Francis Smith (smitfj01@holmes.ipfw.edu) Garrett, Indiana USA	positive
title: A good book [SEP] content: Ishmael by Daniel Quinn is a novel about a man seeking knowledge of human fallacies andhow to save the world. It is about teacher who is a gorilla named Ishmael who has studied human nature for much of his life. Ishmael teaches the man about the two human cultures, the Takers and the Leavers. It gave a lot of insight into human nature and why Takers feel the need to conquer the land. The manner in which Quinn portrays his ideas through question and answer relation instigates self and social analysis. It bashes our culture which is a uncomfortable but necessary. Te reader is involved in the learning process. The format is tiring after awhile, and the book lascks plot. The realizations about everyday life make the book worthwhile and a very good read.	positive
title: Great overview of portable houses world wide [SEP] content: This book does a nice job of surveying the portable housing around the world in traditional and upscale modern applications. However did not cover the mobile home, RV's, double-wides and Modular industries here in the US which is the largest use of mobile housing in the world. Yeah I know, no style, history of crappy cheap construction and lot's of bad press. Regardless, millions are still sold and built in the US and will continue to be, as Mobile housing fits our culture and pocketbook better than Mac-mansions do ! Portable houses does a great job of introducing what other cultures have and continue to use.	positive
title: GEORGE FORMAN MODEL #GRP90WGR [SEP] content: This is a great item and the reason I chose it was the removable plates. It is so much easier to clean than the ones that you cant remove the plates.	positive
title: A tight fit, but worth every penny [SEP] content: I've always wanted to try something more than just the standard paper filters, but money was always the winner in the end. After having to trim some of the rubber molding to fit the filter in my Maxima (not supposed to have done that), it works well. I bought a spare just in case too.	positive
title: Great Product [SEP] content: This rootbeer kit is great. It is easy and fun to use. If your rootbeer is flat, you probably didn't let it sit in a warm, dark place long enough. It also tastes a lot better if you refrigerate it overnight before drinking it. Hope this helps.	positive
title: wonderful!! [SEP] content: this is a very good nancy drew book.even though it took me a lot of time ot locate,i'd say it's really worth the hunt.in this book,cindy austin,the daughter of two biochemists vanishes from her house so as to challenge nancy to find her.but when she gets kidnapped the second time,she's kidnapped for real.read on and you'll know what happens next.i'm proud i bought this book.you will be too,once you get it.	positive
title: Trimline Soft Recovery Collar 4" [SEP] content: This soft recovery collar was terrific for keeping our bunny away from her stitches. She was able to eat, drink and hop around without any problems. The rigid plastic collars were a nightmare! This one was so much easier on us and the bunny!	positive
title: Works as advertised [SEP] content: Works just fine on my Archos 504. As other buyers have noted, similar generic products WILL NOT work on Archos players; it has to be specifically compatible with Archos. Sound and video quality met and exceeded my expectations. I haven't tested this, but I would guess that using this cord prolongs battery life as well (because the player doesn't have to power its LCD screen, the biggest power-draining feature).	positive
title: better-than-average black metal [SEP] content: Once you get past the disorganized drumming (typical of black metal) you get creative & mellodic all girl metal from Greece! Imagine a riot-grrl version of Borgnagar, early Sirenia and (very) early Moonspell. Here's hoping for a second CD from these lovely ladies!	positive
title: I liked it [SEP] content: The book was in good condition. I ordered the wrong book but decided to keep the handbook that went with the book.	positive
title: Another Winner [SEP] content: I am a huge fan of MHC. I have to say this is one of her best. Not too many characters to keep track of. She has a tendency to do that. Which is a weakness of hers.This was very suspenseful. I had a hard time putting it down. No lags in this story. I love the fact that she gets her point across without the profanity that some authors think they have to have.I will keep her on my must read list.	positive
title: Russell Watson is versatile [SEP] content: Russell's versatility talent is shown on this album. The voice is just the voice. This one is not like his albums before which have many classic songs (kind of tenor)that for some is unlistenable,:)(you know..)I am not particularly fan of certain kind music. I do like pop,rock,classical,jazz or should i just say good music.So, now we have Frank Sinatra songs covered by Russell here. Though I am not fans of Frank Sinatra before, I can say I really enjoy this cd and that make me want to collect some Sinatra's album.Last, I would say as a fan of Russell's voice, for non classical audience this is the voice for you to enjoy.	positive
title: THE BEST CD OF THE YEAR!!!!! [SEP] content: What can I say? This is the best work EARTH WIND & FIRE has done in years. I'm most excited about two songs: 1)"Lovely People" (you can't help, but, just get up and dance to it); and 2) "Pure Gold" (Maurice's voice sounds so sweet and rich) I highly recommend that you buy it. You won't be disappointed.	positive
title: My favorite Keith Jarret CD [SEP] content: I have almost ALL Keith Jarret solo CDs, and this is my favorite.Maybe I am biased since it was my first Keith Jarret CD back in high school (wow that was LONG ago), but still it is beautiful.	positive
title: Color is Different [SEP] content: I bought the brown guitar strap. What was delivered was much darker than what is shown in here. I wanted a lighter one just as shown. Anyway, this strap is good. Cannot return the item as I am outside the US.	positive
title: A great addition to your studying material [SEP] content: I've purchased this book elsewhere. But this is not the point. I will compare it to Giles. Much better, both construction of the studying material and exam question-answer part. Unlike Giles, NPTE has thorough explained question and answer choices, and an option of pausing the test. NPTE has three exams. Giles though has four exams and visually it is constructed very closely to a real one, little if any question explanation. Bottom part you'll benefit from both. But if you're short of green go with NPTE. Don't know the difference between NPTE 2008 and 2009 editions though. I'd be thankful if you'll provide that info.Thank you,PoleginI just had a look at 2009 edition. All that's been added is a color print, that is it. Test questions are the same.	positive
title: Pretty good, but not perfect [SEP] content: I've been looking for a portable magnetic chess set. This one came highly recommended. I give it four stars. I generally like it, especially its ability to leave the pieces in place, while putting on the lid.It has some annoying features.The first problem is that a bishop looks a lot like a pawn. Especially in low light, or if you're in a hurry to set up, it's easy to confuse the pieces.The second problem is that some of the magnets weren't well glued to the base of some of the pieces. I went through the pieces one by one, and reglued the magnets to about 1/4 of them.The third, minor, annoyance is that it doesn't have letters and numbers for algebraic notation of moves. I tried using a P-touch labeler, but that ended up looking tacky and cheap, so I hand-lettered the ranks and files with a black Sharpie.I'd buy it again, even knowing these problems.	positive
title: Cow must-have! [SEP] content: Great book if you are thinking about getting a family cow, really the best book I've found on the subject. I love the author's tone and also like checking her webpage info that supports this book!	positive
title: Enjoyable read if you can suspend disbelief [SEP] content: I enjoyed this book, but I still like Stephen King's The Stand better. The main reason is that the characters in Swan Song did not have enough depth. They were either "good" or "bad." I would have liked to see some of Swan's bad traits and some of Alvin's good traits, for example. Very few people, if any, are either purely good or purely evil in real life, and I felt that this is where Swan Song lacked credibility. Sometimes I actually felt like cheering for the bad guys because Swan was just too sugary sweet. Other than that, it was a decent book, worth reading.	positive
title: This book will make your mouth water and your belly growl [SEP] content: This is a wonderful book about eating in the South, eating out and eating in, about a whole host of things like family and fellowship that gather around any groaning board in the south, and what you want to eat where and what the people who live there eat, how to cook it and where you're likely to find it at a reasonable price made by food-loving hands. John Egerton clearly ate his way across the south to write this book, and he was careful to stay well off the beaten path. It's anthropology, sociology, recipes, culture and good humor, from the North Carolina mountains to the swamps of Cajun country. This book will make your mouth water and your belly growl, but most of all it's a fine read.	positive
title: A sharp knife is a safe knife. [SEP] content: Bought this a gift for my dad, and he has been kind enough to let me use it. This knife sharpener is great. Used to use a honing stone - results were excellent but very time consuming. This sharpens everything I have tried (pocket knife, kitchen knifes, outdoor knives) in a few minutes.It is true that a sharp knife is safer than a dull one, but only if you are expecting it! Warn your friends if they borrow your freshly sharpened knife!	positive
title: Dustbuster [SEP] content: So far its a good vacuum and does what I expected it to do. tried other hand vacs butwent back to black and decker.	positive
title: Loads of entertainment [SEP] content: My son was given this when he was 6 months old. He had already mastered his walker and hated the megasaucer. I was worried that with not liking the megasaucer, he wouldn't care for the this also limiting his movement, but he loves it! It has so many types of toys attached to it and different sound options, it's great. The tray that is removeable is actually one of his favorite parts. He takes it out every time and loves hitting it against the other parts, or just holds it in his hand as he moves around. Funny how the slimpliest things are the best fun for babies.It does take up a fair amount of space, so be prepared if you're limited in that area. Another reviewer said it didn't have height adjustment, it actually does have two settings. There's a clip under the material seat that will help raise the entire seat up one time.	positive
title: This is the greatest all boy group I have ever heard!!!! [SEP] content: When I first heard the song "Say It" I was skating with my boyfriend. We had just started going out and we didn't have a "song" yet. I loved this song so much that we decided to make it"our song". I listen to it every night while I'm falling asleep. I love it so much. The only thing I would love more than this song is to have them sing at our wedding!!!!!!!!	positive
title: Great Carseat [SEP] content: I wasnt ready to put my 3yr old in a booster seat, but he was almost to outgrow the 40lb weight limit on his other carseat. The Regent is perfect for him! It was easy to install, and fits in our minivan great! And this seat will fit him for years to come. I'd definitely recommend this seat to a friend.	positive
title: Possibly the best sing-a-long soundtrack ever! [SEP] content: Almost thirty years since the music of the film first saw the light of day, the soundtrack from "The Rocky Horror Picture Show" is quite possibly the best sing-along soundtrack album ever. I mean, is there anyone in the world who hasn't heard such timeless classics as "Time Warp" or "Sweet Transvestite"?This isn't an album that'll appeal to everyone - some of the tracks are pretty naff, but that's part of the fun of "Rocky Horror..". The only regret about this CD is it doesn't include the lovely ballad "Once In A While" (which was, incidentally, cut from the film). In my opinion, that was one of the best songs. Never mind, you still have a great album here, but you really need to see the movie to fully enjoy it.Jon.	positive
title: Key Management Questions: Smart Questions for Every Business Situation by [SEP] content: A must read of every middle level manager upwards to start honing your questioning skills.	positive
title: Works Fine, Auto Shut-Off A Big Plus [SEP] content: This coffeemaker works well. It is inexpensive, easy to fill, easy to clean and fairly fast. The only minor drawback is the lack of an externally visible fill level. The internal fill mark is just about impossible to see, so you really have to measure the water you put in. The automatic shut-off is a big plus. I previously had a similar Toastess model (Toastess TFC-326 Personal-Size 1-Cup Coffeemaker, Black) which was also a good coffeemaker. It had an external fill indicator, but it lacked the automatic shut-off. I kept forgetting to turn it off after making coffee, which probably contributed to its early demise.	positive
title: Best Brush for Dogs with Undercoats [SEP] content: This brush is perfect for dogs with undercoats. (My dog is part husky.) You don't have to use a lot of muscle either to get all the undercoat and dead hair off. This has an ergonomic grip and a sturdy metal frame. I bought an imitation version of this tool years ago. Same shedding edge but a plastic handle. That plastic handle broke on the second use.You can feel that the Furminator is solid and substantial.	positive
title: Excellent value. [SEP] content: When the battery that came with my Canon camera stopped holding a charge, I was torn with spending a big chunk of change on a new Canon battery or just shopping for a new camera that used regular batteries. I was so excited to find this generic battery at such a great price.	positive
title: After a couple of days my tennis elbow was gone [SEP] content: Odd as the exercise sounds and as odd as the simple device seems to be. It worked. Within 3 days i was no longer hurting from tennis elbow. Keep doing the exercises though. Don't make the mistake of stopping just as soon as the pain goes away. Later on if you think it is coming back than go do those exercises again. So glad my boss told me about it.	positive
title: Kilzer is the man!!! [SEP] content: The first song I heard from this album was the radio friendly " Green Yellow Red". I rushed out and bought the thing and was blown away. There isn't a weak track to be found. I shortly discovered that they were all radio friendly. My opinion is that you could take any song from this album have a hit. It's a crying shame Kilzer never received more acclaim than he did, although he was pretty popular in the Little Rock/Memphis area for a while. Not only was he a great song writer and musician, but a very cool dude as well who never turned down a chance to play for anyone. I saw him perform at the Pi Kappa Alpha frat house on the campus of UALR. No band - only a guitar, harmonica, and the man himself, and he is just as good live as in the studio. If you enjoy great stuff with a timeless vibe, this is the album for you.	positive
title: Great debut, very under-rated as far as radio goes... [SEP] content: I have all 3 of Chris's albums, all are great, but I'm just surprised I've never heard much if anything from this one on radio. Good album all the way through but some of my favorites are "Beer or Gasoline", "Burn", "Drinking Me Lonely", and "Small Town Big Time". I would highly recomend all of his albums, he's true country and that's hard to find in today's pop and rock based country trends...	positive
