title: Basic Leadership Principles with Excellent Examples [SEP] content: This book was an enjoyable, practical and applicable read. Phillips outlines a number of basic leadership principles and uses relevant examples from Abraham Lincoln's time as Commander in Chief during the Civil War. This book will be enjoyable both for Lincoln fans and those looking for basic concepts of leadership.The book is broken down into four areas: People, Character, Endeavor, and Communication with sub-chapters that further support each area. Each sub-chapter is synopsized with summary bullets called "Lincoln Principles" that highlight the cogent thoughts of that section."Lincoln on Leadership" is a good primer to provide a basic overview of leadership principles, and will not be useful for teaching about advanced leadership topics. However, Phillips' use of relevant examples from Lincoln's life made the book applicable to a number of leadership scenarios and made this book very enjoyable.	positive
title: The best [SEP] content: OMG you will be on the floor this is the best of Jeff Dunham. He is so funny you will never stop laughing	positive
title: Stonewall and General Lee [SEP] content: Jeff Shaara's GODS AND GENERALS is a very fine book. However, as has probably been said at least two hundred times in the reviews, its not at the level of his father's THE KILLER ANGELS. Part of the problem is that Jeff Shaara is limited in his choices on who to develop on the Union side that will bring both continuity and yet freshness to this prequel of THE KILLER ANGELS. Hancock is the obvious choice, but the Chamberlain is a mistake. It feels forced and flat. On the flip side, however, the choice of Jackson is inspired and easily the best storyline in the book.Despite the criticisms, still a very worthwhile book.	positive
title: ALWAYS A PLEASER!! [SEP] content: I am never disappointed when reading a Michael Palmer. I think the man could scribble on tree bark and I'd be happy.As always, the storyline is believable and easy to follow.Definitely worth the time to read!!	positive
title: Best Of The Best [SEP] content: This Action Packed Movie Is Based On 3 Episodes Called 1. The Third Element 2. Buyer Beware 3. Stormy Weather This Is A Must SEE Movie Its A Great Video And It Comes Out On July 10.	positive
title: Carson MZ-517 Binocular [SEP] content: Thank you for the quick and easy transaction. The binoculars were a gift for my niece and she is very happy with them. I look forward to doing more business with you in the future.	positive
title: The Table [SEP] content: We have this table and its been great! We have it in the dinningroom beside our table...on carpet.She loves to eat at it - if shes ready to eat she goes and sits at the table...the chairs are really light wieght so she has no trouble pulling them out to sit in.The chairs are pretty sturdy to, she has me sit in them all the time and her daddy..lol - I would recommend trying it out -	positive
title: Item Very Small [SEP] content: The product is nice, but small. I was hoping for a larger one. The measurements are described, but, my mind invisioned larger.	positive
title: Home filter [SEP] content: Perfect, finally we have avery good water for everything. Before we use only Aquasana filters for drinking water and for showers, now we have filtered water for everything. Mike	positive
title: Even Frenchmen can learn from this book! [SEP] content: This book is a good start to understand how we the French are so different..of course to us the "Americains" are the different ones...I wish there were more books like this one about all cultures.Even for a native it is always good to revisit some of the history and to understand how behaviors and cultures are shaped by past experiences. It is true for individuals as well as for nations.I am a French living in the states married to an american and finally understood some of the cultural differences my husband and I have been arguing about for the last few years thanks to 60 million Frenchmen can't be wrong!If you plan on living in France, are living with a French or just interested in knowing why French can be so annoying read on! You won't be disappointed.Excellent job on the not so known Algerian war which I agree with the authors has contribute to shape contemporary France as much as WWII.	positive
title: Best I've tried so far..... [SEP] content: Have long, fine hair...& am now using this with my hot rollers...The Redken product made my hair positively CRUNCHY..(Tossed it out!).. This bottle is pretty small for someone with long hair, but gotta have something. It keeps the curls pretty well and adds some shine. Will keep using till I find something better....	positive
title: good for bad backs [SEP] content: I have a recurring pinched nerve in my neck, and I was very hesitant to start yoga for fear of getting hurt again. This video is very gentle, and offers easier versions of traditional beginner poses. I am getting stronger and stronger, and I can now do more difficult yoga videos without fear.	positive
title: Wow! If you haven't read this book, read it NOW! [SEP] content: I loved this book!It was written as a real 13 year old would write!I mean, it sounded like it could be my diary!I never got bored reading this book, and I read it at least 6 times!	positive
title: Provocative and interesting [SEP] content: This was a very enjoyable excursion into an out of the ordinary look at the Old One and various old ways. I didn't always agree with it, but I thoroughly enjoyed reading it and I recommend it.	positive
title: Not to shabby FOR THE PRICE! [SEP] content: Well Invicta definitely has the looks down perfectly. This watch looks exactly like the Rolex submariner. That is where the similarities end however. for the price I can't really complain, however if I would have spent over $100 on this I would have been honestly let down. It feels fairly chintzy in hand, the bracelet is something like you would see from a Chinese knockoff, and the bezel is not as tight as I expected it to be. But the watch has a good quality Japanese movement from Seiko. It works well and as I said in the beginning it looks exactly like a Rolex submariner.	positive
title: Buy it, you will love it [SEP] content: I wish Theresa Monsour has written more books, she is a great writer. I would compare her to John Sanford style wise, however Paris Murphy is very much different than Lucas Davenport is in Sanfords books. I can't wait for the next book!	positive
title: A very powerful story. [SEP] content: This book was very good. I would recommend it to anyone. It really opens your eyes to how some people were treated. It also has a very good story line and kept me guessing until the very end. It was one of the best books I've ever read.	positive
title: old favorite [SEP] content: I love the story; it's a tearjerker for me. Meryl is one of my faves and De Niro has great rapport with her in this movie. Seeing the fashions from the 80'a is always fun too :)	positive
title: Homeschooling: The Middle Years [SEP] content: This is a very informative book especially for first-time homeschoolers. It was well written and very well organized. The resources listed were very helpful.My only complaint was the unnecessary criticism of classroom teachers. Unless Ms. Henry was once a classroom teacher herself, I feel she is unqualified to claim that "the most average high school graduate could produce average work in this not-so-challenging college major." I was disappointed in this display of subjective writing in an otherwise well-written book.	positive
title: Hey I really like This! [SEP] content: This is a good one Laurnea! I have all of your CDs, I think?.I have been following you sense "Betta Listen" your first on Yab Yum / Sony. I have Laurnea II and New Territory both on JVC Japan.I can see the growth in this CD. And it takes you through a journey into Laurnea's world . I really like the smooth happy feeling it gives me and I want to listen to it over and over again. I will buy it as a gift for a lot of people. Her voice is amazing and comforting. Everyone should have this in their collection.Kellie	positive
title: This product does not work! [SEP] content: Dont buy this! It really sucks and does not warm the towels. The bars feel warm, but when you put a towel on the bars it only warms right where the towels touch. Not the whole towel. In the process of getting my money back	negative
title: Soft Metal Means These Break After 1-2 Uses [SEP] content: I was thrilled when these arrived in the mail. The price seemed unbeatable, and they fit securely to all of my standard bits. However, the metal in the hex screws is very soft, and after only 1 use the heads were completely stripped -- making these stop collars completely useless.I was using these in a fine woodworking application. But perhaps if you just wanted to use them as a guide for drilling into drywall, plaster, etc., then you could secure them less tightly to your bits (and thus, hopefully, delay stripping the cheap screws).	negative
title: Good information, but redundant. [SEP] content: I purchased this book to assist in staff training. I have found it to contain useful information. However, after the first chapter, it tends to repeat itself without introducing much new helpful information. There are lots of checklists for staff self-evaluations that, when scored, do not include information on improving their weak areas. Also, as this book was written for the UK, I have found the language to be interesting, but a slight drawback. There is quite a bit of UK slang (such as tatty, taken out of a skip, put a tick in the appropriate column, etc.). And there was an interesting, but not so useful for the US, chapter on British Telecom.	negative
title: Not a Garrett PI series #2 [SEP] content: I am a huge fan of Glen Cook's Garrett PI stories. I really disliked Passage of Arms because it tried to tell about the adventure from several protagonist viewpoints. It's almost like he's trying to write an episode of the world he portrays as opposed to one person's adventure. It does add a lot of pages to the book if he is being paid by page.	negative
title: Downright Silly, Not Funny [SEP] content: Chris Farley plays the role of a clumsy ninja, ridiculous to the extent that I feel that it is an insult to ninjas. The movie is plain silly, not funny. This guy is worse than Jar-Jar Binks.Hard to imagine anybody could find this show funny.This is the worst comedy that I come across so far.	negative
title: City Baby L.A. - Dont buy it, use a phone book. [SEP] content: This book is pages and pages of listings of things like daycare centers and their phone numbers. It is also geared toward the woman who is about to have a baby a lot. Dont waste your money. Buy "Baby's day out in Southern California" which is the great book recommended by the triple-A.	negative
title: Not Worth the Trouble. [SEP] content: While the game appeals to a certain juvenile streak, the fun quickly wears off. The humour value of being able to steal every car on the screen is limited at best. You are left with a repetive game with very little plot to drive it forward. You end up merely driving around the city in circles.	negative
title: Weak copy of need for speed [SEP] content: Everything about this game is lame, the graphics , the user interface, and the very slow since of speed, car's going 150 mph feel like 70 mph! you can pump up your ride to 600+HP! and cars with 200HP will beat you! If you are a fan of need for speed underground stay away from this stinker!! This game is very dissapointing! avoid it at all cost's!!!	negative
title: What a Pervert! [SEP] content: This was a horrible book!Anthony is a sadistic pedophiliac who had been "watching [the heroine] from afar". He had even gone so far as to have her tutored in a language he wanted her to speak.It sickened me that the character was made to fall in love with her rapist."Love" does not justify rape or whipping a woman or any of the other sick things in this book.	negative
title: Crappy crap crap (crap) [SEP] content: This Clerks-esk low budget film is, shall I say, crap. I love Bam and his CKY disks and Viva La Bam make me laugh so hard I have to pee. This movie was poorly acted (no surprise) but the crew are actually trying to act so it just seems dumb. DiCamillo was annoying as usual. The "plot" was boring and average. There are a few truly funny moments but not enough to warrent buying this DVD. Do yourself a favor and buy a CKY DVD.	negative
title: Looks great - if only it worked! [SEP] content: This is a great looking player with seemingly solid construction however after approximately 45 minutes of use, the screen went blank. Thereafter, it would shut down after 20 seconds of play. I returned the item for replacement, hoping that I had just received a dud. The replacement player worked during its initial use however thereafter same problem as before. Moveover, the sound was never great - especially for use in the car. At full volume, it could hardly be heard above the road noise. I would not recommend this player but, as always, Amazon was super to work with and their customer service cannot be beat.	negative
title: College text [SEP] content: I had purchased this book expecting it to be in "very good" condition as noted by the seller. Unfortunately, it is in fair condition, at best. I was very disappointed. The extensive highlighting and underlining make it difficult to use.	negative
title: if you're not a right winger, this book is awful [SEP] content: i feel like i've been trying to read this book for years, but it's only been a day and it says i'm only 12% done, egads, i can't go on. the racial slur when the main character slams arabs, then realizing the girl he's with is an arab changes it to muslims....and she concurs! please....i'm stopping this now before i have to go out and buy an uzi	negative
title: unfortunate [SEP] content: i'm sorry to say this because Kevin Smith is one of my favorites and i'm a true fan so i gave this movie a shot too bad it was pretty terrible. I'm sorry but please miss this movie wait for Clerks 2: The passion of the clerks coming summer 2005	negative
title: Not very good [SEP] content: Although the author has obviously spent a good amount of time doing his research, the time might have been better spent developing a coherent plot or creating charaters of any substance. With all of the excellent books available, you might want to give this one a pass.	negative
title: lasted 6 weeks [SEP] content: lasted 6 weeks then inexplicably went out. not sure if i got a dud or if others have experienced this.	negative
title: What are you guys smoking.... [SEP] content: This game was the worst. I got quite far, but it was boring the whole time. The fist couple of missions are fun. Once they get too challanging you realize that your doing the same exact stuff as you were doing on teh first mission, just a lot faster. The cops have to intelligence at all, they just go directly at your car. The game is a MAJOR WASTE OF MONEY. I reccomend using your money wisely on something like Onimusha, that's a great game with better graphics, gameplay, plot, and variety. Don't waste your money or time. I am aware that this review is on the contrary to most of the others, but I feel that you should take my advice. After two complete hours of gameplay I was bored out of my mind	negative
title: Not a fan. [SEP] content: This particular product takes up way too much free space on my computer. Actually slowed it down a bit. I have 320 GB with 4 GB memory. Kaspersky seems to work better and I didn't have any problem with that at all. Would not personally recommend Norton.	negative
title: not the real Fantasia [SEP] content: Unfortunately, this is another example of the Idol folks trying to mimic trends vs. really letting an artist shine. Fantasia is a great vocalist and the overdubbing and layering on this CD hides her uniqueness--makes it a Beyonce ripoff attempt. Too bad--looks like we'll have to wait a release or two before we get the real Fantasia.	negative
title: I Feel Bad About My Neck - Book Review [SEP] content: Well.... I paid the 9.99 to read I Hate My Neck on my Kindle. This book was our book clubs next read. I've read about 40 pages and so far I haven't gotten into it. I don't feel like it is going to go anywhere. I'm not a person who would ever think about getting cosmetic surgery. I am what God meant for me to be and yes the sags are coming. I am almost 60. My secret is do what I can do (hair, make-up) for going out. After that, don't look in the mirror. LOL	negative
title: rock key hider [SEP] content: This rock key hider does one little good unless you happen tobe carrying around a screwdriver; that's right, the key is obtainable only by unsrewing the plastic on the bottom side of the rock. Oh, and did I mention that the rock looks as phony as a three dollar bill?Why didn't they simply make the slot-a slide version-a complete waste of money.	negative
title: Baptist bashing approach to St. John [SEP] content: If you would like an exercise in Baptist theology purchase this commentary. If however, you would like to know something about the Gospel of John, I recommend you try another commentary. Carson is almost maniacal about defending Baptist belief and therefore rejects the sacramental teaching of the fourth Gospel. He writes in a chatty style, using the lingo of a pseudo intellectual guru. This is possibly the worst commentary on St. John that Eerdmans have ever published.	negative
title: Not very good... [SEP] content: I really wanted to give this book a 2 and 1/2 stars. A quater of this book was really good. The rest was dull, confusing and not well written.	negative
title: Defective [SEP] content: They must be selling all their defective units now. The first one I got stopped working after a month. The one I got a week ago one of the fans didn't work when it came out the box, it also has a short in the cable. Beware of defective units.	negative
title: Dated Material, Some over 40 Years Old [SEP] content: If you are looking for a topical discussion of technical and business writing, I think you can do better.That said, the book is a quick, informal, benign read. Though it purports to be updated, some of the essays go back to the early 60s.Some of the techniques discussed don't quite agree with the methods discussed in Mike Markel's "Technical Communication" or Carolyn Rude's "Technical Editing."If your instructor requires it for a course, buy it used. You'll likely sell it to someone else when you're done, as I will. It makes no sense to lose that much value on the resale.	negative
title: Doesn't keep things hot [SEP] content: I may have just have gotten a bad one, but the one I recently purchased does not keep things hot. I have poured freshly made steaming hot coffee into the Thermocafe multiple times and within an hour it is barely warm. Since the job of the thermos is to keep things hot, I am considering this to be a complete product failure.	negative
title: They dont know what else to do...... [SEP] content: This has to be another effort to be alive on the music industry. The live performance is the same one that come with the DVD from Greatest Hits Part 1. They add "new tracks" as Proud which is on the soundtrack of the movie I know what you did last summer. Earache my eye its the last song from Follow the leader but live. One is from the tribute to Metallica. If all that is "rare" they are really desperate for money.Dont buy this CD buy the new tool Cd which is way better.	negative
title: Broke within 1 month, useless [SEP] content: Don't waste your money! We thought these beds would be perfect for our two dogs, and we ordered extra large to accomodate their respective weights (both under 100 pounds). We bought a total of four beds and three of them broke within one month. Like other reviewers, we saw that the bolts sheared off and as a result, the beds are not able to be repaired. We have asked for a refund; I am optimistic...	negative
title: Failed Attempted Frenzy [SEP] content: This game is not up to the standard of the other x-box titles. The graphics are bland, the landscapes are dull & boring. There are many other games being launched at the same time as this one. I would wait for something a bit more "Next Generation".	negative
title: London Blue Topaz Earrings [SEP] content: I was not at all happy with this purchase. The topaz is very pretty but the s.s. looks very cheap, does not look like .925, it looks as if you could have bought this at a discount store	negative
title: Three weeks, and no results [SEP] content: I been using this cream for three weeks now, and not seen any results. Your better off making it your self. All you need is Baling Soda and Castor Oil to make a paste. Thats all.	negative
title: Well it hasn't caught on fire yet. [SEP] content: It doesn't work at all. The drive is recognized by the USB driver but the RAID utility can not find it or initialize. I have 20 years experience with PC, build my own, have done software and hardware raid under Windows and Linux. This thing should just work. Technical support has hung up on me after being on hold for 15 minutes twice. So I'm guessing they just have so many problems that they are dumping their call queues to avoid busy signals.Your going to be wasting a lot of time with something that really should be a non event.Stay away from this product.	negative
title: Sorry, not much here for me [SEP] content: I bought it for some insight on troubleshooting my PS2, disk read problems. Not much there, unfortunately. That in it's own self wouldn't be a killer, but the fact that the book is 2/3 "guide to games" cinches the deal. It's from 2001, so there are no games since then included in the guide. If you just bought a PS2 (like I did) and you find this for a buck at a flea market, it might be worth it.	negative
title: Not Impressed [SEP] content: I have never really been fond of Ethics and Moral code to begin with because most of the articles fail to realize the whole point of what they are writing about. This book really wasn't any different. The articles about Abortion are weak and they don't fully explain what their whole point of what they are writing about is. It doesn't help matters when every article in this book is so drawn out. Everything that is said in this book could be done so in about 2 or 3 pages instead it is drawn out to about 10 to 15 pages. The authors are basically repeating themselves over and over throughout the entire article.I personally don't think this would be a great buy but maybe thats because I find all the arguments in moral and ethic philosophies are very weak and not at all to the point.	negative
title: Icorrect Information [SEP] content: None of the songs listed in the below discription are on this CD. Save your money. If you are looking for Polly Browns hits, this is NOT the CD you want.	negative
title: Stick to Celtic Work RJ [SEP] content: Alright book. There are better books on Qaballah out there. I was quite suprised to see this author undertake this book, and disappointed. It seems these days that no one is content to develop a purely celtic magical tradition. Are the european peoples ashamed of their rich spiritual past and potential ? Come on people, there is so much to be discovered out there from our own genetic history without having to goto the middle east, Amer-Indians, Asia, the west Indies or Africa. People should be able to get what they want out of the tradtions they have a birth right to, leaving other peoples birthright traditions for them.	negative
title: Disappointing [SEP] content: My husband has been wearing Munsingwear for many, many years. He has noted that each time we purchase them the quality and consistency of fit deteriorates. This last purchase was the final proverbial straw. The leg openings, fly opening and placement, and waist band varied greatly with each pair, so much so that there were some he just couldn't wear at all; they were so uncomfortable. We will not be purchasing Mun singwear again. Ever.	negative
title: Baby Einstein Series [SEP] content: Frankly, for the $$ I was unimpressed. I had heard great things about this series and was sorely disappointed. Each of the presentations seem very "low budget." The filming content did not keep the attention of either my child or my nieces or nephews, ages 6 months to 4 yrs. Next time, I will tape animal/art programs from either Discovery Channel or Animal Planet and play my classical CD's in the back ground. Save your self the $$.	negative
title: Good writing, poor story [SEP] content: Not sure what's with all the rave reviews. I picked up this book thinking it would be a mystery set in mountain country, and to some extent it is. Box has a good writing style, but I did't care for the story. Children being threatened and stalked (or neglected and beaten), harmless animals exterminated, to name a few points I didn't care for. It certainly seems as if Box knows his outdoors; i'd just like to read a story that's a little more straightforward mystery and less rambling mess.	negative
title: Discontinued Product [SEP] content: Just spoke with Macco Akzo customer service - 800-634-0015 (Manufacturer of Liquid Nails products). This specific product line (DR-807) was discontinued in 2008. Any tubes currently on the market are at least 4 years old...	negative
