title: Power Failure and Poor Focusing in Low Light [SEP] content: My new Dimage Z2, just suffered power failure (Purchased Apr 26th). KonincaMinolta does not have local service center and according to their customer service repair volume is so high on this camera that turn around time is 3-4 weeks.You have to pay for shipping the camera, and they will send similarly by ground (add to the cost of purchasing this camera).Besides this I have found that auto focus fails in low light - auto focus does not really works. Manual focusing procedure is so cumbersome that it may as well not be there.I regret buying Minolta, better stick with Cannon A80 - better product better value. And I am long time Minolta user from 400si to 600si (SLR cameras).	negative
title: Do Not Buy [SEP] content: Sorry to post my very first bad review, but please do not buy this item. I have had a garden for years so I know how to grow one. Only one herb grew after planting them all. Please think about it before buying this brand.	negative
title: Don't buy this toaster [SEP] content: Update - after about a month, the toaster stopped popping up. After reviewing the warranty, I have send back the toaster at my cost (will only communicate via letter correspondence), and also include money for them to send it back - FOR A $20 TOASTER. DON'T BUY THIS TOASTER	negative
title: Not what it claims to be [SEP] content: When a publisher presents a book as being a work of history knowing that its author's research is suspect to say the least, I believe the consumer has every right to be upset about that.The problem with this book is not the occasional error or fact or misprint but that the author made claims to his qualifications and research that when checked turned out to be very questionable to say the least.It seems he was never a Lord as he claimed, nor ever a Baronet as he claimed, nor a PhD as he claimed. One asks oneself the question why somebody would need to make all these suspect claims if this book was really what it has been made out to be, namely a work of history.It is however a very good read. That is why I give it one star. It is entertaining. I only hope somebody writes a biography of its author one day (how's this for a title - "The Man of Many Names") as I am sure that will be even more entertaining.	negative
title: Not very accurate [SEP] content: The mechanism inside the step counter is "loose" so any movement adds steps. Also, the counter is on the side, as opposed to the top, and is difficult to read when you're wearing it. For the money - it's not worth a second look.	negative
title: Crap [SEP] content: This is junk, do yourself a favor and buy the one that costs $18 because it is much higher quality. I've gone through 2 of these things, the first one when I tried to insert the battery the connections where the batteries give the device power came out and were deformed in such a way I couldn't put them back in the battery compartment, so I sent it back and ordered another one. The 2nd one seemed to work for like 1 fly, after that it was simply a plastic fly swatter, even when I pressed the button, heard the little sound it makes and tried to kill a fly, it wouldn't kill the fly, nothing would happen. Multipe times I was able to trap the fly underneath the device and despite pushing the button the fly actually flew THROUGH the wholes not getting zapped once. I am done returning this, not once did I receive one that didn't properly work but twice.	negative
title: What a load of crap! [SEP] content: This box set pretty much puts the cap on the career of the Eagles, one of the money grabbingest bands ever to come out of the MEMEMEME 70's. Not one of these discs is filled close to capacity. Nothing like a final rip off. When might I buy somethig else by the Eagles? WHEN HELL FREEZES OVER!!!	negative
title: Outdated and inaccurate [SEP] content: I don't know where to start. This book recommends activities that I consider to be catastrophically bad for hedgehogs, like keeping them on cedar shavings, which can cause respiratory failure. I just can't recommend.	negative
title: Repetition [SEP] content: This books seems to be a collection of smaller works all mashed together. Many sections are simply bullet point after bullet point. The name is misguided. A better title would be Sustainability ventures of business, government, and policy makers.	negative
title: Do not buy this if you have rhythm or know how to count. [SEP] content: This is perhaps the worst workout video I have ever seen - and I wish I could get my money back. These ladies can't count. There are no transitions, no call outs, no instruction. It's as if they showed up one day and just turned on the camera. If you have ever done any kind of aerobics, have rhythm or know how to dance, you will be extremely frustrated within the first two minutes. The moves don't match the music and they fluctuate between 1 and 3, with 2 and 4. Do NOT buy this.	negative
title: CRAP that sometimes works. [SEP] content: The interface is simple enough but it is just not well built. it freezes all the time. Talk to sirius support much more then I ever should... they can't fix it over 2 months to replace unit and STILL WAITING.DO NOT MAKE THE SAME MISTAKE I DID. THERE SHOULD BE A GENERAL RECALL ON THESE. PEOPLE WHO PRAISE THIS HAVE NOT RUN INTO PROBLEMS YET!	negative
title: Not For Adults [SEP] content: This is a good book if you are 13 and under. There is not enough information in it for an adult. If a child wants to learn about five things about church, then this is the book for them.	negative
title: So where are the moves? [SEP] content: This video hypes all the great dance moves it is going to teach you... The salsa and mambo steps are very basic and the rest of the material is just boring. The hand movements are rather comical. The music is OK, but not particularly inspiring. I get much better dance moves at my gym class. Money wasted.	negative
title: You have a super computer ? buy, not don't buy!. [SEP] content: We buy that and we are thinking return, You can't see the software using a normal computer you have to buy first a super computer to run that. The Flight simulator 2004 is better running in a normal PC. you can't see all graphics and detail without a super machine.My machine is a Pentium M 1.7 Ghz 512 Ram, Toshiba Tecra and take 4 hour in the installation process, and 1 complete day to play the simulator.Don't do that to us microsoft please..............	negative
title: Sort of readable but forgettable [SEP] content: This novel is trying to be an exploration of passion but comes off as bloodless and wooden. Fifteen-year-old fallen woman Olympia Biddeford, the main character, never comes to life, and the author's attempts to convince us her relationship with a man three times her age is a deep spiritual love is ludicrous. The book is by the numbers, and the attempt at 19th-century speak is irritating. Did not people ever use contractions in their speech back then? I cannot believe they did not, but I shall not argue with the author further.	negative
title: Same Formula, No Shift Here [SEP] content: Polar Shift is an incredibly formulaic book, with quite a few borrowed plot points from other generic adventure-action books. Entertaining at times, but very generic, and sloppily written, as if the authors had to crank out yet another novel before the deadline. Very little labor of love exhibited in the writing, I felt like the authors were just punching a time clock to collect their pay.	negative
title: How can you dial the phone with this thing on? [SEP] content: It covers all the buttons on the keypad, protecting them from dust, moisture and from being read and used. A pain to put on and remove. Useless design. Mic hole way to small to be heard properly. I had to cut the keypad section off and use the perimeter for phone cushioning. A full leather case is a better investment.	negative
title: Poison for your dishes? BEWARE! [SEP] content: I bought 2 of these tubs for kitchen tasks. I looked VERY carefully at the product description to see if they contained "microban", because I do not want poisons on/near my food/plates/kitchen utensils.The description doesn't say that these are treated, but THEY ARE!Does anyone out there know where to get tubs like this that are not laced with unnessary chemicals?	negative
title: Not the Same as the Old Splintertweeze [SEP] content: I bought these tweezers to replace my old Tweezerman Splintertweeze tweezers. They are not the same at all. The tips are not nearly as pointed (too wide to use precisely) or as flush (won't grasp well). I have always sworn by Tweezerman, but it seems like the quality of their products has really been declining lately. Being fairly clumsy I often ruin my tweezers by dropping them, and it seems like each replacement pair I buy is worse than the last. I bought my first Splintertweeze because I was sorely disappointed by a very dull pair of Point tweezers that I bought to replace my old ones, and now this new Splintertweeze is almost as bad as those Point tweezers were! I am sure that somebody who is used to drugstore tweezers would probably find these a nice upgrade, but if you're used to Tweezerman quality, beware. It ain't what it used to be.	negative
title: Not what I saw in the Quantum Pad Sampler Book [SEP] content: I got this book thinking it would fart just like in the sampler book that comes pakaged with the Quantum Pad. But, it dosn't do anything the sampler book does. All it does is get answers wrong!	negative
title: Bad product / bad support [SEP] content: Ours broke after a day. Customer support was difficult but after many frustrating calls we had replacement parts sent. There were no instructions but we eventually got it back together. It broke again a couple days later.	negative
title: Problem with the order. [SEP] content: I ordered this product as a gift. It was stated that it was the ice cream maker with a "bonus ice cream freezer bowl". When it arrived - no bonus bowl was included. I sent an email which was not answered by the time I called Unbeatable Sale, Inc. After checking they said that they had made an error when they offered the bonus bowl. Instead of making it right and sending the bowl, they said I could send it back which of course I knew. It was a take it or leave it situation. As this was a gift for Christmas, I decided to keep it but I am not happy with this company. I don't know whether it makes good ice cream or not since I gave it away.	negative
title: Chateau Benares [SEP] content: Disappointing use of synthetic instruments and over dubs when Mishra's skill as a guitarist would have been perfect.	negative
title: Good book, terrible kindle edition [SEP] content: First, the content of the book wasn't very coherent. Didn't seem to be organized in any particular way, but the stories were interesting at least. I did find it a bit weird that he used fake names for all his former bosses. Don't you think that they'll recognize themselves in the book?The bad part is that Kindle edition has a typo in literally every other sentence. Clearly the result of a poorly OCR'd book without proper proof-reading. Nearly every foreign word was garbled. This made reading a book about cooking (lots of French terms) really annoying. The publisher should be ashamed to put out such a shoddy product.	negative
title: Unbelievable [SEP] content: This is a most unbelievably badly written book. It must have been dictated and never proofread. I am amazed that it could find a publisher.	negative
title: Purely for beginners [SEP] content: After skimming through the book I found that it was hardly sophisticated as it was originally described. In fact what I read and saw was highly remedial and just plain common sense content. The book did not go beyond the very very basics of painting. I really don't know who I could recommend this book to. If you are seriously considering being a painting contractor this book would hardly prepare you.	negative
title: think of it as a very large mug as opposed to a bottle [SEP] content: The top part is the same as the smaller coffee mug oxo makes. This makes it great to drink from, but horrible to pour out of. As others have said the insulation isn't the best either. To me it wasn't a waste of money since I'm just going to use it as a giant mug and I don't need it to stay warm until the evening. Last time I used it, I filled with 200 degree F coffee and at 6:00 am, I didn't use it until 2 pm and when I poured it out it was room temp maybe slightly warm.So used as a large mug, used immediately (or within a few hours) after filling, it's not bad.EDIT (end of Dec 2009):I just threw it out. It doesn't hold heat anymore (about 1 month of use) and there is nothing redeeming abou it anymore.	negative
title: LUCY GETS A ROOMMATE/LUCY AND CAROL IN PALM SPRING [SEP] content: I am a very big Lucy fan. The only reason I rated this episode as one star is the bad quality of the tape, in particular I am talking about the audio. Whenever you guys see Lucy special boxed sets that seem to good to be true as far as the prices are concerned, DO NOT buy them. I have had problems in the past with these videos. We are better off ordering from Columbia House if they have these available. At least the sound will be superior. We all love Lucy, but we all love our money too. So be careful of these inexpensive tapes that cost 5 dollars or more!	negative
title: Watch Problems [SEP] content: The watch I purchased came to me not working and was sent back. A second watch was sent and also did not work. I sent the watch back and now have made several calls about the refund. The calls are either left on hold or just cut off after holding for a long period of time. I still don't have a refund.	negative
title: Catalina doesn't ruin girls; it makes ruined girls smarter [SEP] content: While Catalina can be at times a stressful environment, King's experience here can only be attributed to her own insecurities. Catalina is an incredibly strong academic school and the faculty here do everything in their power to help students do well. King obviously didn't have the natural ability or drive to succeed that is needed to flourish here, as shown by the fact that the writing in this book would not have recieved a passing grade in my freshman english class.	negative
title: Be wary of these discs [SEP] content: While I'll admit that the price is right: $100 for 100 discs and that the printable surface is superb using an Epson R300 direct to cd/dvd printer... I've had many failures burning a full DVD with this particular brand. My other burns that only make use of 25 to 50% of the disc were great, no problems. It's just when I burn a DVD that has about 4.36 gigs on it that problems arise, with skipping, stuttering and sometimes complete failure to recognize the dvd from both my computer dvd drive and my set-top dvd player. In short, I can only recommend this brand if you plan on not using the outer tracks of the disc because I surmise the dye on the outer portions of the disc media is not consistent and will lead to burn and/or read failures.I recommend TDK brands at this time over Memorex brands.	negative
title: Unimpressed [SEP] content: Not a good live performance. The band is not in sync. Godz original debut album is the one to buy.	negative
title: disapointed [SEP] content: I wanted the sound track from the movie the way the music was on the movie.not somthing eles that was not in the movie.	negative
title: Fleece Sheet [SEP] content: The product is good value at the sale price of 29.00. If it were priced at the retail price implied---$60.00---it would not be since the Company Store equivalent is much better quality. But for 29.00 for a kingsize set, its pretty good.	negative
title: Does'n work in car ! [SEP] content: It works in car (charging), but stops navigation. Vehicle Power Cable, when I plugged it in my Garmin NUVI 660 turned off the navigation mode, and put my device on charge mode. So how can I use my Garmin navigation system in the car ???	negative
title: Picture and Accuracy are deceptive [SEP] content: The picture shows the watch and another item....that other item needs to be strapped to your rib cage which is uncomfortable to wear. I would be able to go through the discomfort, but the product was not reliable either. As a consumer, I would like to know the accuracy. If it says my heart is beating 50 beats a minute, as an engineer, I know that it may not be the case. I want to know the range that my heart may ACTUALLY be beating at.	negative
title: Forget [SEP] content: Well, this aint Jefferson Airplane and definetely not Jefferson Starship. This is just Mickey Thomas trying to do his best and without good songs and the magic circle of Freiberg/Slick/Kantner/Sears he was falling down like Roman Empire. Being Finland's biggest JA/JS fan I bought this album the day it was released down here and played three times. Since that I have kept it far away from my other albums	negative
title: Super fast!! [SEP] content: This was the last book of a trilogy that I absolutely LOVED!! The delivery was fast and the quality was excellent. I will do it again. Thank You!	negative
title: This book is an outrage for any fan of Evita [SEP] content: This book is written for those people who want to read trash about Eva Peron. I stopped counting how many times he called her a 'little whore' and all the references to her 'whore's mouth'. It is disgusting.	negative
title: battery died after two years [SEP] content: I purchased two of these products, and they worked well at the outset. During various power outages and surges, they kept everything smooth and functioning. My complaint is that, after having it for less than two years, the battery backup died. It still works as a surge protector, but that's not why you buy a product like this. I don't know what the expected life on this product is, but two years seems too short for the cost.	negative
title: Trash [SEP] content: maybe i didnt know how to work this thing, or i got a faulty machine but i had to return it because i didnt like it. the pads were not responsive, unless i hit it extra hard buy reason 4.0 instead	negative
title: Musical Kleenex [SEP] content: Joss Stone's a decent singer, but shouldn't be writing songs; or releasing them. I couldn't find a single memorable tune here. I also thought her singing was too flamboyant, but perhaps it's to keep up with the heavy production, which is so overcooked it's insufferable. Next time Joss should try losing the rappers and the big beat overkill. As one critic wrote, "Sometimes it takes more balls to go it alone then with a whole crew." I couldn't agree more. This album is like musical Kleenex, use it, then lose it. Better luck next time.On the other side of the coin, there's "The Orange Album" by Stefy (Rae) which is a stunning debut. Had Gwen Stefani made it, journalists would have called it a pop masterpiece. It's new artists like Stefy that could keep the music business afloat. Are we listening Ms. Stone.	negative
title: You get what you pay for [SEP] content: As another review mentions... no MACROS!The LCD buttons don't really work.I do love the learning feature, I was able to program it to handle my iPod remote control! Battery life is good, might not be be for everyone.	negative
title: Horrible Construction [SEP] content: Do not waste your time or money. I should have taken the other 1 star comments more seriously. This product is a piece of junk. The 'leaves' fell off when rinsing prior to first use. Tried using one time and many leaves fell off. Trying to re-attach just causes others to fall off. I have no desire to bend the tabs further to fix a poorly constructed product. I'm sending this back.	negative
title: Scream 4 [SEP] content: Scream 4, directed by Wes Craven, stars the original cast mates Neve Campbell, Courtney Cox and David Arquette is a horror movie, or shall I say a "good" horror movie. Surprisingly, "king of scary" director Wes Craven, does a mediocre job revamping the final sequel. It plays on the original Scream, and pretty has the same story line, just a tad bit more gruesome. The movie starts of with a series of movies with a movie. Scream 4, plays on the whole android/ iPhone bit, using an "app" to prank call people using the scream voice. Sidney Prescott (Neve Campbell) returns back to Woodsbro to finish promoting her book. Coincidently it's the 10th anniversary of Woodsbro slaughter. The killer is threatening to kill everyone close to her, especially her cousin Jill (Emma Roberts). I wonder who the killer is now....?	negative
title: Not a fan [SEP] content: MY previous review was deleted because some people marked it as spam when I was only giving my opinion. Just for the record...I've seen the first 3 Twilight movies & read the books...SO I KNOW WHAT I'm TALKING ABOUT. I'm just not a fan of this one sorry. Too much hype over a movie. I understand it's a fantasy, romance film, but I'm not convinced sorry. It's my opinion and I don't believe it deserves 5 stars.	negative
title: Missing text/sentences make this annoying to read [SEP] content: I was amazed when I first discovered the missing text/sentences in this edition, but I am halfway through this book and have many many times come across places where it looks like this: ......" said Vronsky. And the missing text is just not in there to read!This is a five star book but I give a 1 star rating on account of missing text which is unforgivable IMO.I don't understand how this has happened???	negative
title: The Sex Pistols [SEP] content: Sex PistolsThe recording is rough but ok if your a Sex Pistols fan. The packaging is far greater than the quality of the CD inside. Recommended for the experienced ear of a true Sex Pistols fan.	negative
title: so, to get the original theatrical releases on Blu Ray... [SEP] content: You have to buy EVERY superman movie? Including 3, 4, and Returns, which are terrible?That's really sad. The Theatrical Cut of Superman is an iconic classic, but the extra stuff that Donner added (the cheesy Lois Lane jokes, the lame "action" sequence at Luthor's lair) really detract from the original.Sometimes cuts are good cuts.Now, you CAN'T get the original theatrical cut of Superman, unless you have an old Laser Disc player. The original cut was BETTER. Better flow, less stiff bad jokes, and act three really cooked.I will NOT buy all of these terrible superman films, just to get that original Superman cut. I'll wait.	negative
title: Not impressed at all. [SEP] content: I was first introduced to Rachael Davis at the Smoky Hill River Festival in Salina, Kansas (where I'm from) back in 2005. Everyone kept raving about, "oh, she's got a great voice and an extraordinary talent, and she's a great guitarist, blah, blah, blah". Well, I bought the album taking everyone else's advice. I have met Rachael in person, and she is a very nice person and has a very sweet and sassy personality.Sorry to say, but I listened to the album for a good 5 to 10 minutes and it almost gave me a headache. It's nothing but just loud singing, screaming, straining, and shouting at the top of her lungs. And it is very boring to listen to. Nearly put me to sleep. Almost every song on here sounds pretty much the same.I was expecting better.	negative
title: Nazi Minister of Propaganda and Theologian [SEP] content: Just a note on Kittel."Kittel wrote a 10 volume Biblical Greek Lexicon Kittel's Theological Dictionary of the NT. The first 7 volumes were written while Kittel was Hitler's Minister of Propaganda, while the last three volumes of his Biblical Greek Lexicon were done while he was in jail for his War Crimes."[...]	negative
title: What a disappointment! [SEP] content: I've liked or loved all of the Pulitzer winners I've read. I bought this book because it won the prize and expected to at the very least -- like it. Sadly, I didn't like it and had to force myself to finish it. I hung on only because I knew it had to get better. And, it finally it in the last 20%. But, not enough to redeem the first 80%.	negative
title: What a brilliant marketing ploy and apparently still working today! [SEP] content: I recently read a comment on a Beatles Youtube video about how the man in the video wasn't really Paul. I thought that was settled back in 1969! I had no idea people still believe this crap in 2012. Maybe the rumor was started because of the Beatles perceived threat from the Rolling Stones (I never read anything about it, I'm just here to add a comment). It's totally brilliant though and keeps people buying their music even today, although they could sell it without this stupid rumor because their music is great. I would say the Beatles are my favorite band with the Stones a close second.	negative
title: Still Waiting... [SEP] content: I ordered this in the middle of March. If it takes much longer, it will miss the whole Spring season... Sure would be nice to have what I paid for. What in the world takes so long to mail a magazine?	negative
title: Dose not work.Waste of money [SEP] content: I got the first mall tycoon for my birthday last year and it didn't work I took it back 2 times and got new ones and none of them worked. When mall tycoon came out I got it again for my birthday, I'm a huge fan of these kind of games have them all. But just like the first one the first 4 times I loaded it and it didn't work and when it did it didn't work good. Its a waste of money and a big disappointment, I was very excited by the concept of building the mall but all that happed was that i was disappointed.	negative
title: Bratz runway Playset [SEP] content: This toy is a great toy for a young girl. There are four dolls that you can play with it.	negative
